brand,model_hint,score,clean_text,sentiment_score,sentiment_label
rollsroyce,,10,"somewhat related, but my uncle owns a ram promaster van he s a contractor and uses it as a work van. he was telling me that one time he was replacing one of the taillights and on the inside of the light, it had a very small fiat logo on it. i know it s all fca stellantis but i thought that was an interesting tidbit.",0.5499,positive
tesla,,42,"wish we had an official r cars owners blog or substack or something, so many good posts but reddit sucks at surfacing them and sucks at searching them after",-0.5515,negative
lucid,,17,"base is 77k but it s super stripped down. no adaptive cruise control it s an option . no sunroof moonroof glass roof and you re not allowed to option one unless you go for the higher level trim. one choice of interior color that you better love. some stripped down audio system. basically take out any normal features you would expect in a car that s going to be 80k with taxes and that s the base trim. they clearly don t want anybody actualy buying it, the touring trim is the first trim that has normal luxury features and it s 20k more. honestly if your price limit is 80k you re better off buying something else, because that super stripped down base vehicle makes no sense.",0.9822,positive
bentley,,11,"i m a fan of the ford s smaller transit tourneo vans the focus based connect and the fiesta based courier. i just want mildly sporty versions. put the 2.3 ecoboost, 6 speed manual, and awd system out of the focus rs in a transit tourneo connect with the us market power seats and leather upholstery and other trim from the titanium trim level including sync3. lower it slightly and put it on medium profile tires on 17 wheels. call it a connect rs. offer both the short and long wheelbase version, in case people want to move a big family fast. sell it in the low 30k s. put the 200 hp 1.5l inline 3 ecoboost from the current generation fiesta st into a tourneo courier. lower it, nice wheels, tasteful body kit, etc. call it a courier st and sell it around 20k. this would be my ideal two car garage for my family.",0.8689,positive
ferrari,,4,yet it was already getting outperformed by the early 90s f1 cars with half the power. power isn t everything.,0.0,neutral
lucid,,79,"that s not what this is describing. this is simply the money that was taken by these brands instead of dealers. if dealers had made those transactions instead, the money wouldn t have changed...only who pocketed that money. the study says nothing about whether the customer saved anything or not. in fact, the article alluding to tesla s per unit profit being much more than the average dealer profit might indicate that customers paid more than they would with the dealership model. but that s hard to actually determine because tesla s profit might just be higher because their cost to produce is lower.",0.6428,positive
tesla,Model S,6,"most of the plaids problems can be fixed, mine had no major build quality issues and i installed unplugged performance s ceramic brake kit. for the price the plaid 10k ccb kit is still 70k cheaper than your spec. idk about you but for a daily beater i had a hard time spending more than 50k let alone nearly 105k. that and any other fast charging network is shit, plain and simple.",-0.8922,negative
porsche,,10,"yup. my old house was the sneaky short cut drunks would take from several bars to all the neighborhoods in the area. they d come flying around a turn, lose it, and then end up in my yard. the three trees on the right of way took out several of them and protected my living room. it was interesting to hear a loud crash one night and then find the front end of a cts 30 from the street on my front door step. i was able to follow the trail of coolant, oil, and plastic half a mile to the owner s house and return it to him, along with several choice words.",-0.4215,negative
porsche,,30,any car forum pulled up to a more expensive car today and i was admiring it when i noticed the driver s gf peeking over to smile at me. the driver was obviously upset and decided to rev his engine. little did he know my cheaper car has a cheap mod and cheap mod and i blew his doors off on our way to the next stop light. it was a close race but it sounded like they didn t know how to shift lol. i could see him fuming at the next stop light and chuckled as his gf proceeded to leave his car and enter mine and we drove off into the sunset while she admired my superior driving and money saving skills.,0.899,positive
porsche,Porsche,10,"the major issue, imo, is that paying big maintenance bills or repairs on a 911 or any porsche sports car is less painful than on a cayenne that s depreciating faster with a lower value floor. you re kinda catching a falling knife as they say in investing but the knife is falling faster with the suv. if it s a forever sports car that you love it s easier to justify. again, just my experience after dealing with cayenne repairs.",0.8529,positive
porsche,,17,"i find it a bit annoying that people on this sub are almost using this as a defense of gm defense of the car is one thing but people are treating gm like they are some indie company, they are worth 50 billion dollars, they can find some pennies in the cushion to book time and a proper driver as they please if they don t choose to thats on them, its still a fair comparison against the rest, not going to fault the germans for giving it their best shot. to be clear that is still some very impressive driving for an engineer, no disrespect to drew",0.9875,positive
rollsroyce,,10,"i park my gt3 at oak and sfo all the time, and it s never been stolen or broken in too. i wouldn t be too hard on yourself for parking at the airport. honestly this is completely dodge s fault, and they ve been aware of this issue for years. if you really love chargers i d probably get another one and follow the advice of other commenters like the person that suggested getting the key programming module disabled.",0.7317,positive
rollsroyce,,65,"probably a well equipped minivan for the amenities, space, seating position, and big windows. as a passenger outward visibility the big priority, as well as a bit of room to reposition my legs periodically. on more aesthetic grounds i have ridden in a rivian and their use of interesting materials and colours in clean, modern shapes, as well as the glass roof, sets a very pleasant vibe.",0.923,positive
bentley,,23,"trust me, car manufacturers aggressively cut any feature, no matter how cheap, if it didn t hurt the sales of the car significantly",-0.5535,negative
bentley,,5,"i mean, it s not that i m abrupt or choppy or anything in managing the vehicle, i just feel that there is some more smoothness i could get out of me and the car but i can t get to it. mostly it s the clutch, when i rev match it seems i m 100 rpm higher or lower than needed. plus the gearbox, which in my 500 is either very smooth or annoyingly harsh depending on who knows what. as for big heavy cars i ve driven an xc90 fully loaded, with 6 other people in it and a discovery 4, but those i cannot just hop in and drive whenever i please since they are my uncles cars. edit i also have a friend that always readjusts midcorner multiple times like he s turning using a joystick in a videogame. it s pretty annoying lol.",0.8847,positive
lucid,,3,"it still isn t fine and the stats back it up. it s actually a traffic violation that just isn t enforced regularly. unless you have a very valid reason road conditions, danger ahead, construction, temporary posted speeds then it s a violation to impede the safe, reasonable flow of traffic. since the rest of traffic is going to be going at least the speed limit, it actually isnt okay to be going below the speed limit in the right lane. you should never be driving much below the speed limit. the obvious exception is in bad driving conditions. in every other situation the reality is that if you can t at least do the speed limit then you re not confident enough to be driving at all. and if it s because you want to save a few dollars a year in transit costs, you re just an asshole. slowing everyone down so you can maintain peak efficiency instead of driving at a regular speed is serious dickhead behaviour.",-0.9061,negative
bentley,,15,"i want to ask a stupid question. so, i have an alpha platform car. and while i keep hearing that the alpha platform is one of the best out there, i m actually a little disappointed in mine. in particular, i find the suspension to be too soft. if i m not careful while driving spiritedly down some of the lumpy rural roads in my region, a dip in the road will cause front end nose dive, and that ll send my front bumper cover straight into the road, scraping for a moment or two until the springs rebound. i never had this happen on my previous, sigma platform car. my shock absorbers are brand new, too, only have about 2,000 miles on them. granted, they re passive, not magneride. still, i find my alpha platform car to be jittery and unconfident. if i had to give it an anthropomorphosized personality, i d say it drives like an overconfident teenager who just got his license and thinks he s a racecar driver now. is it just me that dislikes the alpha platform suspension? is the magneride better at handling this kind of thing? might i even be doing something wrong, or even thinking about the car the wrong way?",-0.6238,negative
bentley,,410,"oh they have a stigma. just less people care about stigmas in the usa. oh you want to be a rich asshole, cool what s your insta, can i follow you, omg you screw over the govt, how cool",0.8756,positive
bentley,,6,"the first time i was taught to look ahead was by my instructor at my first bmwcca autocross. i blew the first corner, then the second, because it was just a sea of cones to me. he said, just look ahead, and it ll become clear. it felt like the course went from 2d to 3d in five seconds. i went from being lost to placing mid pack by the end of the day. so i kept practicing on the street and read going faster! and speed secrets , and that s where late apexes and smoothness came into play. and i kept practicing on the street. then i did my first drift event, then my first track day, and i kept practicing on the street. then more and more track days, and i kept practicing on the street. my street practice built muscle memory to make my track practice more effective.",0.8353,positive
rollsroyce,,3,"oh my bad, i took it as dior was sponsoring the current auction of the car or whatever. i should probably work on reading better. still a fun excuse to shit on lvmh, though.",-0.1531,negative
rollsroyce,,15,,0.0,neutral
bentley,,10,they also sit waiting for parts for a month or more. that s a huge issue.,0.3182,positive
bentley,Continental GT,4,"not the same as your car but similar engine, a buddy of mine had a 2006 continental gt for a while and he loved it. he eventually had to sell it after a few years cuz the engine maintenance was getting ridiculous you hear more about the v8s because there are more of them , but he said it was the best engine he s ever experienced and he wishes he could afford the upkeep on it, so you made a solid choice. i just hope you have a backup car cuz he had to bust out his civic maybe once every month or two. edit he bought it for 20k with 64k miles from some russian guy in miami back in 2014, it did not have a good life prior to coming to him",0.9441,positive
ferrari,,5,"i ve been trying to pin down exactly what bothers me in the design for a bit. the whole section behind the rear tires including the tail lights that are just bad just feels off like it doesn t flow right with the rest or something. then there s something about the front that i can t pin down, i think it s either the angle of it or the overall height of the front end not height off the ground but like measured from bottom of front bumper to highest point of the hood . one day it s gonna click, i m hoping when i see the z06 they change enough that i can finally figure it out, because i really want to love the car",0.9341,positive
rollsroyce,,3,"i couldn t agree more. it also bugs me when, and this is not only chevy, they will state that the cars start at 22,950 but in small print at the bottom it says that the one shown is 36,560. like, it s just blatant lying when you display all of these features and make it seem like your shit doesn t stink when in reality a corolla im has the same basic features that your malibu has you bitches!",-0.9252,negative
lucid,,89,"i was hoping to read about whatever they did to increase their efficiency and only got a blurb about heat pumps now standard across all trims. heat pumps are not new. this article is shit. 5 mi kwh is impressive though. i personally get 5.3 mi kwh with my bolt over its lifetime so far 27k miles . however, i typically get 20 30 better than epa rated efficiencies in all of my vehicles so my results are not representative of the bolt s efficiency and more so of my driving and commute being friendly for efficiency.",0.9584,positive
tesla,,13,"i m surprised anyone would want that, especially on this sub.",0.296,positive
rollsroyce,,41,"i ve got the new 7. i m not sure if i ve ever been in a more comfortable car in my life. also extremely solid and manages to stay flat and composed in the corners. purely anecdotal, though, and can t claim to have driven them back to back",0.546,positive
tesla,Model S,19,driving a cayenne with basic options back to back with a new model x isn t terribly different to me.,-0.5574,negative
porsche,,2954,"can confirm, kia dealers are massive shitholes. i went into one trying to test drive a stinger. i walked out 5 minutes later angry. after greeting me the salesman asks me where are your parents ? i was caught a little off guard by this but i didn t respond. after showing me around the car in the showroom i ask if i can test drive one. he responds by saying are you sure you can handle something like this? do you want to look into something a little more affordable? . i told him i was sure and that i was really interested in this car. he then attempts to steer me over to the niro in the showroom and suggests i consider it instead. i thanked him for his time and walked right the fuck out. edit yes i was driving my z06.",0.9304,positive
ferrari,,13,you might find downgrading from the 150 to the 40 a bit of a shock,-0.3818,negative
ferrari,Ferrari,133,"i ve seen a 10,000 hand welded titanium akrapovic exhaust on a ferrari and it was fucking beautiful about 100 different rainbow colors of oxidation and the welds looked perfect. turned the thing into a full fledged le mans car sound wise. exhausts these days are very complicated bits of kit and for a car that s rarely driven and all about spectacle, weighed down with a ton of sound and emissions control business. i m not saying you should be a total dick and strip it all out but these high and aftermarket exhausts will pull out say one of three cats, the one that s only needed because of california or something, and simplify the muffler. can save a lot of weight, open up the sound, and add real power to these cars. same idea as superbikes being sold with factory race kits now everyone mounts the race exhaust and it can add 10 15hp on some bikes. there are different kinds of aftermarket.",0.5423,positive
porsche,,6,"two cars i ve owned that shocked me at how little they depreciated a 2015 subaru wrx sti and a 2012 jeep wrangler unlimited. i only owned the sti for a year and did no mods, just maintenance oil changes, and traded it in to a dealership for 4k less than its purchase price. if you like the car it s not for everyone and can get a new one, it s about as good an investment as a depreciating car can be, but resist the urge to modify it, to help retain value.",0.7964,positive
ferrari,,45,"exactly, they ve had 12 years so we know it s not a one off or short term problem.",-0.4019,negative
porsche,,11,i m game but not for 50k in options to make it decent.,0.0,neutral
porsche,,28,,0.0,neutral
tesla,Model 3,14,"i m not sure how it is when driving the model 3 but i had a mk1 yaris that had the speedo in the middle on top of the dashboard and it didn t take much to get used to or back from, you just learn to glance in a different position. a bunch of different cars have speedo s away from the traditional instrument cluster and nobody really complains about them. i get all the other issues with the model 3 s screen but i don t think the speedo being oddly positioned is really one of them.",-0.4802,negative
porsche,,7,"reliable... hmmm... type 1 and type 2 split case vw transaxles were used for many years in dune buggies and racing with engines around under 300hp. edit if you look om dune buggy websites you can find a lot of vw transaxle both swing axle and irs, and custom transaxle builders like mendeola",0.3612,positive
bentley,,4,"exactly op mentions the kia sedona specifically, but in many markets outside of the us it was the same car under the name carnivale. i believe they ve dropped the sedona nameplate altogether now and call it the carnivale worldwide.",-0.3818,negative
porsche,,4,"this. as cars get older, the repairs just start to cascade. one year, you might be paying negligible amounts and the next it seems like everything breaks at once. if you love the car and intend to keep it forever, it s easier to justify the repairs because it s just a drop in the bucket in your ownership time of the car. if it s just transportation, you ll never sell a car faster and, ironically, get less money out of the sale because you timed the market wrong.",0.6486,positive
tesla,Model S,2,well here s hoping they eventually make a next gen x...,0.5994,positive
rollsroyce,,40,and it s doubly stupid because the cars are 100 used as a flex. there s absolutely nowhere in seoul where you can take these cars and let it rip. there s speed cameras literally everywhere. driving is soooooo annoying in korea. rented a car there before. would not recommend. fucking speed bumps on the god damn freeway although very low and it s more like rumble strips or a wavy type speed bump one after the other where it causes the car to bob up and down,-0.8025,negative
porsche,,3,"haha, usually people tend to really get on me when i make long posts because my use of punctuation is quite off at times, i speak a number of different languages so i feel i am decent in terms of use of words, my only reason for the disclaimer was because it s reddit and for some reason people get mad when i use a comma in the wrong place or something like that. still trying to learn the language to the fullest and funny enough, some people on here have been quite helpful, but also i do really appreciate it when someone says my english is good, makes me feel like i m actually getting somewhere with this language!",0.934,positive
tesla,Tesla,20,,0.0,neutral
porsche,,8,"it isn t tail happy unless you want it to be. the car responds to whatever you tell it to do. if you go into a corner too fast, it will understeer. if you brake hard on turn in, you can feel the rear end get light and if you tell the car to do so, you will break the rear end loose. if you get on the power while this happens, the rear will slide smoothly and predictably. but if you don t want to slide, the car will predictably and smoothly regain traction. snap oversteer doesn t exist with this car. it will never catch you off guard. you ll never be scared of it. because the car is responsive yet isn t trying to kill you, it will make you want to go faster. it will make you want to try more risky things. but if you exceed your skill level, the car won t punish you by sending you spinning into a tree. i m not one of those people who believes in that whole soul and emotion crap when it comes to cars. i love all cars. everything is fun if you have the right mindset. it doesn t matter if it s a vintage ferrari or a box truck. i believe if you re a car enthusiast, anything should be able to excite you if you want to be excited.",0.9616,positive
tesla,,3,"2016 2018 works great. 2019 is an absolute dumpster fire of blue screens, random shutoff s, crashes and reboots and less features no built in txt msg display app . my complete system and screen has been replaced multiple times, cameras replaced, dash torn apart etc. as someone who s owned multiple new gm products and whose father worked there for 35 years i must advise everyone to run away from gm as fast as possible while making sure none of your friends or family make the same mistake. i will be back to buying hyundai s again. i only left because of the gm family discount and it was not worth the trouble.",-0.4374,negative
porsche,Porsche,9,"the 924, 944, and 968 manual transaxles are all pretty reliable, with the 944 turbo and s2 boxes being the best 5 speeds, and the 968 6 speed generally being robust as well. the 5 speeds from the regular 944 924s 944s are reliable as well, but are not as robust and can t cope with higher power engines. the early 4 speeds are fine, but not worth using. the 5 speeds are better, more abundant, and cost about the same. the problem transmission in that family is the 5 speed from the early 924 turbos that s a porsche designed unit and it s a bit crap. all of the other manual transaxles from that family of car are audi based, and they re good. the 928 s 5 speed is fine as well, although they just don t feel particularly refined imo. they seem to be tough though, there are a number of high power supercharged 928s out there running the stock transmission.",0.8099,positive
lucid,Lucid,26,"i mean, building a 600 mile or 1000 mile for that matter ev isn t exactly a conceptually hard thing to do... you just put in a bigger battery and maybe improve the aerodynamics. which is exactly what lucid did. not trying to diminish their accomplishment, but it s very straightforward engineering make car look like jellybean, add 30 more batteries than model s. done and done. the only question is can you build it for less than people will pay for it. tesla thinks no, lucid thinks yes. we ll see who is right i hope it s lucid .",0.8968,positive
lucid,,18,"and if the m5 had been going at 60 mph instead of 70 mph when the others started it wouldn t have even been close. it was already a pretty arbitrary, contrived scenario to make the e39 cross the line at a similar time as the other two so the idea of the bmw winning in this scenario seems a bit immaterial. when the starts are so different it s not really a race and more a demonstration of how much faster cars have gotten.",0.8062,positive
tesla,Model S,1,and they ve already been beat on range too.,0.0,neutral
porsche,,6,"the in depth icons and revelations video take a lot of work to produce. doing all the background research, finding the period correct cars, writing the script etc vs making drag videos",-0.2263,negative
tesla,Model S,2,did they implement a hybrid system finally ?,0.0,neutral
rollsroyce,,5,"yeah, wheels and some red trim pieces. i don tind the exterior but the red trim inside looks a bit naff to me.",0.1531,positive
bentley,,37,"i would say the ford panther platform. that platform existed from 1979 to 2011 and was the basis of so many ford made sedans and wagons in that time period. the fact that it last more than 30 years is impressive imo. from the panther platform, we got the ford crown victoria, mercury grand marquis, lincoln town car, and the ford police interceptor, and all of those were very reliable and last well past the quarter million mile marker. some panther cars have made it to 400,000 miles.",0.8126,positive
