brand,model_hint,score,clean_text,sentiment_score,sentiment_label
bentley,,7,"seat is much more aimed at younger drivers than vw and skoda traditionally were. seats are meant to be exciting. skoda is aimed at people who see themselves as frugal and who would scoff at anything as frivolous as interesting styling. vw traditionally was positioned as can t go wrong with it, but still affordable . their cars were somewhat non boring, somewhat comfortable, somewhat up to date on tech etc., while not standing out in any one aspect. all of this has been changing lately. vw has moved upmarket into semi premium. this has allowed both seat and skoda to expand their audience. but now vw has started to try and lure in younger drivers with the up! and polo, making seat somewhat redundant. consolidating the low cost segment in skoda and the young driver appeal segment in vw makes sense. young drivers either buy the absolute cheapest version or they have the money to pay vw prices anyway. seat cupra can focus on offering the more exciting versions of vw s model range.",0.8446,positive
tesla,Model S,-1,"i guess the saving grace is that the poor engineers at tesla have to fulfill whatever ridiculous promises elon makes. so even if elon is bullshitting, someone in the background has to make it happen.",0.4019,positive
ferrari,,3,"how did you feel the eps steering system in the 991.2 compared? obviously the wider front track width helped turn in a great deal, but did they get the tuning on the electric system to come close to how the manual systems feel? porsche is basically top of the world in terms of eps feel currently, and the 997 is a very high bar to match. i ve spent a lot of time in 987 and 997 porsches and the steering feel from those cars is 2nd to none.",0.6261,positive
ferrari,Ferrari,5,"i suggest keep manettino in sport setting keep rpms 6000, but feel free to toggle auto shifting off if you want. you can t overrev the engine accidentally, it won t let you. learn how to use the front lift button before you leave the dealership, and always use it if there s any doubt about clearance. ferraris sit pretty high check out ferrari wheel gaps sometime but its still probably lower than what you re used to. give at least 2x normal distance to car in front of you when on a freeway. rock chips suck extra on these cars. feel extra badass for a weekend!",0.7678,positive
rollsroyce,,28,"in australia i see a lot of early to mid 90s recession era sports coupes the kind they don t make anymore driven by what appears to be the original owner in some cases i know they are, because they ve been at the same house since i was at primary school . things like 3rd gen honda preludes and integras and the last mazda mx6. since i moved to melbourne i have seen a lot of old holdens that have been one owner cars. particularly 70s and 80s era cars.",0.6597,positive
bentley,,128,"the 6.75l is such a cool engine. even the displacement designation is cool. what else gives you two decimal places? those repair costs are, uh, not great though. spending 60 of the purchase price right off the bat seems less than ideal. hopeful the specialist is right and that will be the last of it i m sure matt can afford it anyway so it doesn t matter, but sheesh .",0.6036,positive
rollsroyce,,4,"i didn t like it. the harder i drove it, the worse it got. it was great for tooling around the city, doing some drag pulls and feeling the vibe of the motor. i really like the throb of the engine and that was attractive to me. the shifter was nice once i got used to it, as was the clutch and throttle. the motor was very on off switchy because it was an sti, but that was ok to me actually. it was kinda fun to just have the turbo explode like that on the street. it wanted to be shifted fast. but when you start showing it some canyons, it really falls apart and doesn t want to be hustled. i had no confidence in the front end. it remains the only car i ve ever smoked the brakes on, and i wasn t even driving it that hard.",0.9033,positive
lucid,,4,,0.0,neutral
bentley,,3,"i always try to drive my boat in the rolls royce method of braking. very gently engage the foot brake, and essentially slow to a stop instead of just abruptly halting, as to not disturb your rear occupants, and potentially spill the champagne! here s some good tips on being smooth, doesn t cover the braking i spoke about, that s taught in the rr driving school.",0.8865,positive
ferrari,,33,,0.0,neutral
tesla,,4,"did you get your miata used? have you tried deep cleaning the seat belt? i have a used car that the seat belt wouldn t retract very well, it s because it needed to be cleaned. buncha vids on youtube that can show you how much build up there can be.",0.4124,positive
bentley,,4,"i have no doubt this guy worked his ass off, and he deserve this car. however, that being said, social economic class of a person s upbringing play major roles in how successful and rich someone will become. yes, your average engineer from mit makes 100k right out of college, and having a good college degree with hard work help will give you more financial stability than probably anything else. but even without op s parent directly give him money, he may very well have received a better education, and have had more opportunity for employment, or been able to pursue his own passion without fear for financial instability. bill gates can leave his kids with absolutely nothing, but they will still be miles ahead of almost anyone on this sub.",0.9789,positive
tesla,,8,"this is what i was going to post in response. 2024 numbers are reported here. i know 2025 feels like it s been 3 years already, but it s only half over.",0.1901,positive
lucid,Lucid,6,"i think they are aiming at where tesla was, but not where tesla is going. in the early days of tesla, they said they d steadily move down market and they have. from the roaster, to the s, to the 3, each has been cheaper than the last. their idea was to eventually get to a mass market affordable electric car, like an electric beetle, and change the world. there s only so much market for giant luxury sedans that cost more than the yearly median us household income, by the definition of median ooo, great, 500 miles range. well, i ve gone 120miles in the last 2 weeks according to my trip odometer so i see the appeal. that cost me 15 in gas, so spending hundreds extra a month on an electric car payment to save me that is not gonna fly. i can do about 50 month extra over a gas car. price will get me electric, not better interior plastics, 1 sec off the quarter or 20 more range. lucid is missing the mark by shooting high. where s that cute little electric retro civic from the car shows a couple years ago? that s what would have tesla worried if they are staying true to their vision from years ago. is lucid trying to be google to tesla s yahoo or is it vice versa? what about bing? this market segment has echos of the dotcom boom.",0.9632,positive
ferrari,,17,"i had a similar experience in deep rural new mexico, stopping for gas in a tiny run down town. i stopped at a gas station that at first, i wasn t even sure was operable. an older man, maybe 70s, stood up from his bench where he was just passing time watching cars pass at a rate of about 3 per hour , and started talking to me about the lotus exige s240 i was driving. he knew what it was, loved lotus, knew it was the toyota engine he thought v6, but the us didn t get those models but had never actually seen one in person. very cool interaction in an unexpected place.",0.6946,positive
bentley,,3,"you bring up a good point. even the cheap hard textured plastics people complain about today on a new hyundai, comparitively speaking its still light years better in terms of quality, look, and feel, compared to 80s and 90s plastics. i m not too old but i still think of hard plastics as the kind from my families ford aerostar van, or 1982 toyota tercel. recently bought a 2019 jetta and car reviewers complained about the cheap plastics, i was like holy shit this interior is great!",0.7712,positive
tesla,Tesla,27,,0.0,neutral
rollsroyce,,3,"61 ferrari 250 pf coupe in the rain. the wipers gave out, we rigged up a string that i pulled back and forth with both hands. then a throttle linkage broke...we rigged up another string that the driver madman peter markowski pulled on while driving . that was an absolute blast.",-0.6124,negative
lucid,,3,"yes fair enough, especially the awd part",0.6124,positive
ferrari,,3,i actually do agree with this particularly with regards to the drivers screen but imo the rest looks tacky as is. it doesn t have to be ostentatious like it is in a pagani or bugatti where the attention is drawn to button design but it should at least be good imo,0.8338,positive
porsche,Porsche,3,"from aspirated to turbocharged i drove a 991.1 manual 3.4 when they were new ish. at the time i considered it too modern boring, now i would love if porsche could make a car like that again.",0.6597,positive
bentley,,5,,0.0,neutral
tesla,,18,"they started losing me even before leon took his mask off, with the stories of terrible build quality and customer service.",-0.6908,negative
tesla,Model S,2,"that s good news, any idea how this was finally fixed? i experienced this the last time in august last year.",0.4404,positive
tesla,,91,"the stock market is completely untethered from the businesses that each ticker symbol represents. how else could the nyse be at all time highs during the worst economy in 80 years? this disconnect has existed for a while now because interest rates have been kept so impossibly low for so long. everyone keeps dumping all of their cash into the stock market because there s nowhere else to get any decent roi, so the prices just keep going up up up.",-0.6983,negative
bentley,,10,we set out to make it as diverse and up to date as possible. but that doesn t always work out. would your layperson,0.0,neutral
porsche,911,21,"i don t understand 911 operators. i once called in a rollover on a street in north sunnyvale. car was upside down after rolling several times, driver hanging in his seat belt, conscious but bleeding profusely from head and other wounds. gas pouring out over everything. i asked operator how i could determine if driver had no neck injury and was safe to move. operator ignored me and kept asking dumbass useless questions. meanwhile driver starts trying to self extricate...",-0.8177,negative
rollsroyce,,119,,0.0,neutral
tesla,Model S,12,"take it around the ring, see how much outperforming it does not a lot",0.0,neutral
bentley,,606,"digging a bit more into the numbers they sold 2967 lamborghinis for 895m total revenue and 248m operating profit. that s 301k sale price per car, 83k profit per car, with a profit margin of 27.7 .",0.8271,positive
tesla,,4,,0.0,neutral
tesla,Model S,12,a full on documentary. this is the best savagegeese video yet.,0.6369,positive
lucid,Lucid,20,"there are different market segments. you can cater to the luxury market of shoppers who are willing to spend more, which provides you with higher margins or the mainstream market that is more budget conscious and therefore provides lower margins, but you move more product. this is a simplification, but lucid is aligned to the luxury market. they currently serve a niche, which is higher end evs.",-0.1531,negative
tesla,Model S,166,"probably cost, certainly cost in tesla s case. it s not just bevs either, the screen era is spreading to all cars. even the latest wrangler, at least partially, haha! i m also not a fan, i just put up with it in my y since the rest of the car, especially the powertrain, is so darn good. i m hoping there s a pushback at some point but since it s motivated by money i m not holding my breath.",0.8591,positive
rollsroyce,,3,"op, amazing post you won t get the credit you deserve for this. any way you could continue your research and bless us with some stats on capabilities of modern vs old trucks? i swear people have misremembered the capabilities of old trucks vs new. people will talk all day about smaller engines vs v8, complain about turbos, etc but ignore that a 3.5 ecoboost i m a f150 has more torque than a 7.3 powerstroke in a superduty 20 years ago.",0.3291,positive
bentley,,3,"that s fair, we just never got many options to begin with. i d love a diesel hilux from ye olden days but my options would be import one most likely rhd which i don t want to do or swap a us market diesel into a roller. also important to note that in the us, we have a fuckload of large open highways and roads. great highway mpg is a massive plus, which gas engines are just now catching up. my 2014 diesel passat would still return 40 mpg at 80mph, my current ford fusion mondeo for y all will only get that high at significantly lower speeds, though it is a hybrid and that s not really what it s for.",0.8674,positive
bentley,,8,"i think the vibe they were going for is adventrous, outdoorsy, rugged.",0.0,neutral
tesla,Model S,9,,0.0,neutral
tesla,Model S,4,"no. you have to understand multiple things here 1. people don t like change. it s why americans refuse to adopt the metric system, we don t want to change after all these years. 2. it will become harder to compare old cars to new cars. for decades we ve used the 0 60 time, and we ve used it on old car models. having to retest those car models for acceleration up to 80 will not only make them seem even more slower than they already are compared to new cars, but will also be a pain in the ass in general to test all of those cars again and wait years for results. keeping 0 60 would let us still easily compare new cars to old cars while not having to sacrifice speed times, our time testing cars due to the inability of converting 0 60 times to 0 80 times without actually testing the cars . 3. theres nothing wrong with 0 60, and honestly no one i know floors it from a complete stop all the way to 60 or 80 in real world driving. nonetheless, keeping 60 would be the best choice.",-0.1202,negative
ferrari,,28,"bring everything back to cfm. i love watching 1320 videos, the worst question they ask? how many pounds of boost are you running? . it means fuck all. we need a streamer youtuber with enough followers to change the minds of the hive. not nearly enough people watched or recall the dyno proven data mythbusting from engine masters with david freiburger, steve brulee and steve dulcich.",-0.264,negative
tesla,Model S,3,"tesla gets a bad rep for certain aspects of their build quality. however, where they lack physical quality, they make up for in software. the average tesla owner isn t a petrol head and doesn t care about panel gaps, creaky plastic etc... they want a car that will get them from point a to b in a cheap and comfortable way.",0.4767,positive
tesla,,9,"i have a mk7 gti and love the knobs buttons for climate controls. also the knob on either side of the touch screens are favorites too because if i m on a bumpy road or something, i can just use the selction knob to easily select what i want to listen to or do on screen. i m honestly not looking forward to even newer cars as they go full digital everything. even in the gti if i m using just the touch screen, i ve had issues where i accidentally touch the wrong area which now becomes a serious distraction. it s just as bad as looking down at a phone.",0.2023,positive
bentley,,31,"no warning lights so far fingers crossed pros looks handling sound at 3500 rpm and really really quiet when below that really good gear box shift paddles infotainment does what it s supposed to, play my music from my android phone whenever i get in and not be annoying otherwise seats are great i have the default ones all the driver assistants are actually quite nice cons might look like more, but mainly minor things not really eco friendly exhaust flaps opening at high rpms means that the car will suddenly fart loudly when you shift too late while accelerating. really embarrassing... race mode has them open all the time but in winter and inner cities, i stay clear of that function p doesn t lower side mirrors when reversing solution is to have your seat presets have one with the mirrors already lowered only huge rims available, already scratched up... front sensors doesn t really work that well for small objects, scratch up the underside a little bit including the front splitter brakes way too hard and the suspension really throws you back into your seat when you stop, otherwise actually really good suspension and right now i m still battling with squeaking brakes at low speeds, always a looker when the italian car comes to stop p but overall, i don t really care about the cons. i mean look at it",0.703,positive
ferrari,,7,"there s one at my local dealership. 200 miles, original window sticker.",0.3182,positive
ferrari,Ferrari,37,"i ll reiterate doug s point, ferrari is missing out by not offering a low production special edtion gated manual car. there s a market for people who will pay more for a manual whether it s for the driving experience or to speculate on. porsche has figured it out. it boggles my mind that lamborghini and ferrari haven t figured that out yet. yes, there is a large contingent of the market who just wants the fastest lap times or can t drive a stick, but there s also a market for people who have money and want a gated manual.",0.4131,positive
tesla,Tesla,9,,0.0,neutral
lucid,,7,"even tesla took until their 3rd model to introduce something affordable , and they should ve started with the y over the 3.",0.0,neutral
bentley,,119,"what do you mean? a brand announcing a 2 door instead of an suv is a good thing! also the current t f type looks good, so while i wont by this i think it is good. there is not much choice for a 2 door inthe ev market except for the upcoming porsche boxter cayman and some chinese stuff",0.8398,positive
ferrari,,3,"the best way to lose a sale is to be a pretentious asshole. a few years ago i was car shopping after my mustang took a dive and given that i didn t know jack about car buying, i took my dad. we made it clear i was the one buying it, but he talked entirely to my dad. as someone who was buying their own car, not having my parents pay for it it was insulting. i now tell everyone shopping for a car not to go to that dealership, plus the sales guy was scummy in general",-0.5187,negative
porsche,,11,nah porches s cheque just got there sooner,-0.1027,negative
rollsroyce,,8,the gap between avg and wealthy is huge in korea.,0.5859,positive
ferrari,Ferrari,3,"now i m not accusing ferrari of cheater review cars for magazines ..but it s not like it hasn t happened before. also an instrumented test in a prepared surface, like a c d test, is going to have a different result than just picking a section of asphalt to launch from. in a rental.",0.2368,positive
bentley,,7,"so, that would be more like xk successor, it wouldn t be any thing like f type just a pure roadster. xf and xjs were known their 2 2 coupe models. however, jag didn t sell so many xf when it was in lineup, it even didn t sell more than newer f type.",0.7548,positive
porsche,,82,"similar story. i had a terrible salesperson recently. took my keys for a trade in, which i had expressed interest in, but when he offered me 500 for my lexus i told him i wasn t interested and to give me my keys back. he would not until i literally told him i was no longer interested in buying the car. i had told him that my father passed away when i was younger when he asked about a co signer, and from that point he referred to me as son and claimed that he could guide me like a father figure. i d never felt more disrespected in my life. fuck that guy.",-0.0366,neutral
rollsroyce,,29,"as someone who works in business strategy for companies like this, i can tell you that this is at best an informed opinion, and not the true accurate full picture. other reasons people are buying luxury autos they essentially couldn t travel for 2 years and found other fun things to do with that money the labor market is super strong, and they have extra money and feel confident that they ll stay employed all that money rich old people usually spend on opera tickets wimbledon fancy restaurants whatever wasn t spent for a year or two i mean, carpe down could be a reason too, but i ll bet it s not even the primary driver of luxury auto purchasing during the past two years.",0.8964,positive
tesla,Model S,2,"they re cool cars, the fuck is this comment?",-0.296,negative
ferrari,Ferrari,5,"honestly, i wonder about having a transmission. yes, you don t technically need one in an ev. it ll add maintenance cost and make the car slower however, i do miss the revving, and i don t think that ferrari owners care about maintenance cost",0.8074,positive
bentley,Bentley,41,i mean most bentleys are based on modified panamera chassis from a technical perspective. seeing this guys former role at porsche he might know just the right stuff.,0.0,neutral
porsche,,3,"this reminds of of a corner in my hometown that has a long history of accidents going all the way back to when my grandfather was a child, so at least since the 40s. the corner connects two very long straights and back in my grandfather s childhood, the corner had opposite banking. so, if you were traveling east, you would be turning left while the corner slopped right. he lived about two hundred feet from this corner, and as he grew up he and his brothers would go outside to see that nights car wreck. my grandfather said it got to the point where he would wake up to the sound of screeching and immediately go back to sleep. fast forward to his early twenties when he became a volunteer firefighter and bought a house two doors down from his childhood home, so closer to the straight away. he said the most memorable wreck was when he was getting ready for bed. he heard this guy grab third or maybe even fourth gear as he roared by, my grandfather knew what was coming and already had his pants on when he heard the guy crash. around the 1980 s my parents opened their business in an older building that, although stood well away from the road, it still was at the center of this turn. fortunately by this time the banking was fixed. unfortunately, the banking acted as almost a jump straight into the poll that held their business sign. every time someone crashed into the post, the sign would fall down. it got to the point that they simply propped the sign up against the pole.",-0.7463,negative
porsche,,79,"i sell cars at a subaru dealership. we refer to those folks in the industry as tuesday afternoon folks, because it s usually slow so i m not missing a chance to make money by taking a kid out in a wrx. you always try to be polite about it, but if someone isn t interested in buying a car they re basically telling me they want me to work for free. i m happy to do that sometimes, but if the first words out of your mouth to the salesperson are i m just looking today, can i drive sports car you have to understand that we don t get paid to go on test drives. that said, never judge a book by it s cover, what people say and how they act says volumes more than how they look.",0.939,positive
bentley,,10,the screen is where the three analogue dials are on the dashboard. the panel rotates to show the screen or nothing at all.,0.0,neutral
porsche,,30,i was so confused for a moment reading the title thinking who is hans?,-0.4572,negative
tesla,Model S,16,because they re kind of the default ev car manufacturer. if you build a 60k sports car people are gonna compare it to the corvette. if you build an off roarer people are gonna compare it to the wrangler. if you build an electric sedan people are gonna compare it to the tesla 3 or s.,0.0,neutral
tesla,Model S,4,according to my hs biology teacher that could be the most efficient car on the market. it produces pure water as a byproduct. this was 35 years ago. the downside. it s very flammable.,0.2716,positive
ferrari,,59,"i don t think it s the build quality that s been an issue. from some mclaren owners i ve spoken to, it s the reliability. their service is top notch, but you don t really want to see those guys too often. hopefully they ve made the artura better. i remember being at thunderhill quite a few years ago and was speaking to the personal mechanic of a google exec. the dude got paid to maintain the mclaren others to but mostly the mclaren . he said that car was the best of the lot the guy owned... if he could get it going. the google exec didn t want to wait on mclaren s service so got his own personal guy. lol",0.9667,positive
porsche,,44,,0.0,neutral
tesla,Model S,1,"if you re looking to be thrown back when you hit it, look at torque. if you are drag racing look at quarter miles eight miles etc. if you want overall power look at horsepower",-0.1531,negative
porsche,,14,,0.0,neutral
rollsroyce,,21,tesla s when they first came out. i had never ridden in an electric car before and when they punched it and i stuck to the seat in silence i ll never forget that. also just walking up to it and getting in and the car was already on and ac running in silence was trippy.,-0.0859,negative
rollsroyce,,3,"air port parking. the one running the lot is calling the thugs. that is 1, and when you lock the doors, they grab the data. also cover the vin they can with the right napa know how program a ebay 9 dollar key fob. that is if they are driving off with it. many thugs use the same rig gear as the repo man, a snatch and grab unit on a pick up or wrecker. they can hook up and be going in under a minute or less. watch video s on youtube, they don t even have to get out of the truck. most people turn a blind eye to it, as they think it is a repo. not thugs steeling it.",-0.4939,negative
