brand,model_hint,score,clean_text,sentiment_score,sentiment_label
ferrari,,10,"i ve been to katie s once and i remember seeing the car. my friend who took me, who s a regular at katie s, brought me by the car because it was one of his favorites. it s crazy to see a story about a car you saw at a car show across the country i was living in louisiana at the time . sorry for the loss of your friend. i m pretty positive he would greatly approve of your night out with the car.",0.9001,positive
porsche,,24,"with the c8 it s less about dealer markup though i m sure there will be plenty of those for the first 6 12 months , and more about the c8 that you actually want is probably gonna be over 70k. the base model is just under 60k read 59,995 before ttl , but if you want something like heated seats and the actual 495 hp, you ll be getting the 2lt trim and the sports exhaust or the z51 package. x200b just the 2lt trim alone is gonna bump that price to 67,295 the z51 package adds 5k to the price across all trim levels, though you can get just the sports exhaust for 1,195. no word on what the power output will be if you don t choose that option, but it will be less than the 495 hp advertised. and if you want the magnetic ride control you have to buy the z51 package and then you can pay an extra 1,895 for that. x200b i recommend taking a look through chevy s pricing guide idk about you but if i had the money for a new vette, i wouldn t have the discipline to avoid checking any of those boxes.",-0.6908,negative
tesla,Model S,1,"my parents 2019 forester and their 2023 ascent love phantom braking. i ve only had it happen in lile 1 5 drives with the ascent, but with the forester it was basically once or more a drive and my dad even had it do it to where it almost got him hit.",0.3818,positive
tesla,,5,"likely a sloppy technician not following proper procedure. this applies to all cars when you replace whatever module stores the odometer value. you have to transfer the old value over to the new module manually. maybe bit ironically it is the same reprogramming tools that are intended to enter old odometer value into a new module that also get used to do odometer fraud and can be easily be found for most brands. some cars store a odometer backup value in more than one place, i.e. instrumental cluster and ecu, though i m not aware of any that it restoring automatically. it is more intended for integrity might trigger error codes or and fraud checking.",0.5809,positive
tesla,Model S,1,"perhaps. but i used to get phantom braking with auto pilot several times a year for the first few years of my 2022 model 3. i drive the same roads but in the last 2 or 3 years i never have that problem anymore. for me, it s a non issue. but that doesn t mean others don t get phantom braking anymore.",0.438,positive
tesla,Model S,5,"no, you can t modify a carrera into a gt3 rs. the frame is physically different there are fastening holes in different places to mount various components, such as the gt cars double wishbone front suspension, as needed on the respective cars. if you re willing to compromise the integrity of the frame by cutting and welding, or somehow re fabricating the existing frame to fill in old holes and thread new ones, you can perhaps get 99 of the way there. but aside from the compromised rigidity, you re also looking at easily 7 figures worth of parts and labor to change quite literally everything you can see or touch on the interior or exterior. would you like to keep going, or are you willing to admit you re out of your depth yet?",0.8462,positive
rollsroyce,,51,,0.0,neutral
bentley,,13,apple carplay is great. i definitely don t want that banned from cars lol,0.7845,positive
ferrari,,125,"i suspect much of the cost in offering manual gearboxes is in designing the car around both gearboxes both the chassis and also electronic systems such as tc and esc and certification of both the auto and manual versions of the car for emissions crash noise etc... for every major market you plan to sell it in. take rates will still have to be fair high for the business case to make sense. that said, every little bit of cost saving helps.",0.0,neutral
porsche,,34,"you re beyond right. i work as a financial advisor. when i was more junior i d spend a lot of time in an inbound queue for new clients. calls would usually go like this. they d tell me what they wanted out of the call. i d get some background info income, assets, debts, goals, etc and figure out how to best help them out, both in terms of answering their question and determining if they were asking the right question. i d get a lot of calls about financing a new car home improvement and if it was a good idea or not. or they d have little to no understanding of investments and want to learn about bitcoin or something they heard about from a friend. i d ask my standard background questions and discover a lot of them had basically no savings investments and significant credit card debt. i d try to explain to them why that was bad. sometimes not even sugarcoating it much, straight up telling them they re not going to be able accomplish shorter term goals or have a comfortable retirement if they don t start spending less or making more money. a solid 10 of those people had unique, tough unfortunate situations and legitimate excuses. another 10 actually just had no idea what they were doing and wanted to learn and changed their habits. the remaining 80 were usually reckless spenders who lived behind their means and had no interest in talking again because i didn t give them validation a simple answer. some would get straight up pissed off at me for telling them the truth. so can i finance the pool or not? well bro you re 45 and have 3 children and already used basically all of your retirement savings to buy a house you can t really afford, so you probably can finance an in ground pool, but.... i ll say it again, i don t fucking want to talk about my debt, i ve talked about that enough i called you to learn about passive income and you can t answer a simple fucking question yeah you have a solid 5 figure balance in credit card debt at 20 interest and less than 5k in liquid savings and no other investments and are trying to tell me i don t know what i m talking about because you saw an entrepreneur spend 30 seconds telling you how to be rich on tiktok. it s ironic, i commented something earlier today on how car salesmen can be scummy my friend is one and all of his coworkers are shitty . i talked with him today after making that comment and he was explaining they re really not that shitty. people walk in the door every day determined to make absolutely awful financial decisions. he doesn t lie to them. he gives them all the numbers they need to make a financial decision. even if he did proactively try to advise them against buying cars they can t afford, they probably wouldn t listen and would just go to another dealership.",0.9309,positive
lucid,Lucid,19,"i want to see lucid succeed, but their design language fails me. give me a semi equivalent lincoln.",-0.3506,negative
tesla,Model S,1,"several reasons. they re test beds for future mainstream products, essentially. new, different drivetrain for 90 of their buyers. so it thematically makes sense that the interior is different. the consumer is expecting some alien thing. not so much the regulars on this sub talking about the several hundred million who don t keep current on every other car article. the relatively high starting price for entry level models also means your average buyer is going to expect something different. an ev really isn t functionally much different, so we get some strange interior choices. a couple years ago i d have argued that the main things separating one ev from another is the interior and how shitty the outside looks, but it feels like we re leaving that period now.",-0.0516,negative
rollsroyce,,3,"i don t know if i should have. the experience of driving so many different cars for what is a reasonably small sum of money in the scheme of things? i value that really highly. i also wouldn t have known what i would like. i thought these other solutions of xyz would work back before i did this, but those assumptions were wrong. i thought a corvette would be great for me, for where i live. but in hindsight it wouldn t be. i thought the wrx sti was also viable, but again, wrong.",0.0387,neutral
rollsroyce,,3,it is nearly a tonne as a dressed meteor which has various heavier parts as it was for ground vehicles only. and it is 6 foot long!,0.0,neutral
porsche,,61,prime example of crumble zone vs survival cell.,0.0,neutral
lucid,,6,"i have an m240 not a new one but a 2018 w b58 . have also owned and driven multiple 3 and 4 series bmws. i wouldn t compare them in any other way than the excellent drivetrain. he mentions it in this video about the tires being kind of skinny for the power in the 340 already. but i d say that goes x10 in the m240. it is way too much power compared to how skinny the wheels are in the back, regardless of what tires you use. m340 will feel much more competent and stable on the road than a 240. the m240 is fun as hell but it s honestly kind of insane how much the wheels spin. feels way more sporty than luxury.",0.8789,positive
rollsroyce,,14,senna. i thought i mentioned that in my previous comment. i hope you are able to find a senna and have a shot at fiddling with the mirrors yourself. i think you ll find that your statement does not apply to all cars and drivers.,0.4404,positive
tesla,,1050,"i love love love technology, but i will never support touchscreen devices controlling things like aircon, volume, etc. those functions need to be done without taking your eyes off the road, and should always be dials buttons. edit some of the responses are interesting. yes if a car is properly set up, you can blindly control things like volume, air temperature, air speed, etc, so you don t take your eyes off the road. there s so many cars out there where you can t, so i can understand the confusion, but those are cars that are poorly designed. also, voice control, imo, is not a reasonable replacement for physical controls, since voice control is notoriously unreliable.",0.9404,positive
ferrari,F8,9,"hey, i also have a car which is poorly regarded because of the sound f82 . it s also widely criticized by the bmw enthusiasts for being the first m with a turbo, and for having too much torque early on. i actually think all of those except the sound, duh are features not bugs enjoy your 718. it s more than a capable car. the only recommendation i always give to everyone with a fast car including myself is to take more driving classes i.e., track days with instructors .",0.035,neutral
tesla,,4,"yes, but turkey isn t in the eu and relations are getting worse. the eu will not be eager to allow a significant amount of cars into the common market. the upcoming factories inside the eu e.g. in hungary will have a much bigger impact.",-0.3432,negative
bentley,Bentley,5,"yeah i am totally on board with you. i am no tesla superfan, my dad has got one x and one s, they are very nice cars, no doubt about that, but i still love the roaring sound of an ice engine. nevertheless, choosing between a model x and one of these suvs bentley, rolls, 200 k range, then i would without hesitation get a fully loaded p90 p100 when it comes x. the x is more unique in itself, and for me at least, a suv is about comfort and performance, and the x brings more comfort with the space and the autopilot summoning stupid gadgets than those 2 300k suvs. a fully loaded x gives you 160k left compared tho those. thats when you can get a really nice weekend car for those sounds and a real driving experience. in that matter a suv simply cannot compare to a real, low car.",0.9406,positive
bentley,,3,"for me, the ioniq 5 n being as well sorted and fun to drive as it turned out to be. it was pretty quick for a big hunk too.",0.8225,positive
bentley,,7,"if i try to drive my e30 in temps much higher than 110f for any sustained length of time, it sputters out and stalls, reeking like old, stale gas. let it cool off and it will run again for a few minutes, but will keep shutting off until ambient temps drop back down. cooling system keeps up fine, temp only goes a little above normal, nothing worrisome. all i can come up with is its vapor lock, but i ve never really heard of that on efi cars. or the fuel pump just can t handle it, one of the few things on the car i have never changed.",0.4285,positive
lucid,,9,"wrote a longer writeup somewhere here i ll try to find and link but in short its great. about as comfortable as my previous gle, more capable, it looks like a normal car, has the traditional physical mercedes interior, drives like a normal car, no crazy regen braking nor assists, and all the luxurious bits without a crazy wheelbase. not perfect. i wish they d used some of the newer hardware tech for cruise w lane change hands free, the slightly nicer signal gear stalks, its nowhere near as convenient as my previous model s in regards to automatic functionality, dash cam, etc. but it does a great job of taking the best of my previous two cars and putting it in one fairly livable yet capable package. only big thing is i wouldn t mind if they managed to fit a slightly bigger battery, even if it weighed more and took longer to charge. i m hovering around 200mi in the freezing winter w winter tires on, which isn t that bad, most ev suvs around here with similar tire weather will do mid high 200s, but i d like a little more leeway. but relatively small price to pay for not looking like a ball of play dough.",0.9925,positive
tesla,Tesla,6,"it never has been. tesla s can regen at 250kw but are lowered to 60kw and it s still unsettlingly strong. they will probably need to reduce it from the cars already lowered strength, the car default program could break fragile packages. the semi can regen at maybe a gigawatt. they use multiple 250kw superchargers at once to charge now. that was already turned down for regen not even rinac uses it as an on off switch i don t know why anyone would suggest it.",0.8047,positive
bentley,,12,at least the outlaw s rear 3 4s angle looks less shit,-0.5118,negative
bentley,,6,gotta drop the whole subframe to have any hope of working on those things,0.2023,positive
tesla,Model S,4,"the charger rt also had a distinct, if admittedly quite small segment. it didn t really directly compete with the mustang camaro despite being similar. the charger daytona ev on the other hand is just a worse, more expensive tesla model 3 ioniq.",0.0258,neutral
ferrari,,8,"i don t think it s worth shitting on anyone for it, these types of low level fraud are common in any industry tied to location based taxes. i would do it too if i had that level of income toys. why wouldn t you? you save upwards of 5 10k annually for about 1 2 hours of your time and maybe 1k lawyer fees which you could wrap into your business expenses anyway since he probably does work for you at a corporate level . i did something similar when living in chicago and had my plates and car registered in indiana at my parent s house. never got bothered by cops about it, but it did save me some hassle, and a few unnecessary fees.",0.5394,positive
tesla,Model S,15,have you been in one? the interior makes the rav4 and crv look pathetic. driving dynamics are decent too. having a nissan badge on the front with the cvt history is the only reason rpgues are not wiping the floor with the japanese competition. they are a very compelling product. the tucson and trax have better interiors also. i honestly cannot understand why people are buying rav4 s at this point the interiors are so dated and cramped.,0.6697,positive
lucid,,3,"do you think price wars between oems will magically stop at the prices that dealers charge for the cars? why? oems are already selling the cars for less than oems charge, seeing as how the dealers are buying the cars from oems for cheaper than they sell them to customers. invoice prices have always been lower than dealers are regularly charging customers, and that s not even considering rebates and sales incentives that oems give them.",-0.7236,negative
rollsroyce,,5,wheel alloy sizes. the rubber cushions you so having big alloys means less cushion from the wheels and it needs to be compensated for with something else. i specifically chose a trim for my car that has the normal 16 alloys and not the 17 or 18 can t remember which because i hate how driving on low profile tires feels.,-0.7003,negative
porsche,,9,"stock boost is low too, 12 psi. owners flash tune it to 20 psi and gain 80 hp.",0.6124,positive
tesla,,6,nada.,0.0,neutral
tesla,Model S,4,"well sure, but i needed the 4 doors and spacious back seat for my family situation. the porsche would have to be a third car. i ve actually purchased 3 new vehicles this year and i m remodeling my home. there won t be any porsches anytime soon and i should probably wear blinders when surfing r cars for a bit.",0.8047,positive
lucid,,3,it trickles down in the form of more efficient electric motors and higher density battery packs.,0.5095,positive
lucid,,3,"funny about noise in the panamera st. the turbo, with the sport exhaust engaged, is loud af outside the car though some want it louder still . inside though you could be in an s class if you have the noise insulating glass as mine does. but if you read the rennlist forums most people actually complain about this they want it to be louder inside when they engage the sport exhaust. like...why did i pay extra for this? as for the taycan, i ve driven the regular one but not the ct or st so can t say. in general, the taycan is weirdly quiet, quieter than the model y.",-0.6054,negative
rollsroyce,,6,,0.0,neutral
porsche,,9,"they have a completely different engineering manufacturing culture over there. where companies like toyota and honda will gladly keep using the same latching mechanism in every car for 20 years if it ain t broke, don t fix it , the germans will invent an increasingly complex version every year just because they can. the problems arise when they do that with components critical to the drivetrain of the vehicle. you should look up kaizen and the toyota way it s interesting stuff to me at least .",-0.0516,negative
ferrari,,34,quoted 0 60 from c d for the zr1 is 2.2 seconds. it s absolutely nutty fast.,0.0,neutral
bentley,,4,"this isn t for the obscenely wealthy, thats rolls royce people, this is the niche luxury alternative to urus se, cayenne turbo gt, maybach gls amg gls. they probably sell 2000 4000 a year.",0.3612,positive
bentley,,14,"so i grew up in a country where underage drinking laws weren t enforced at all, as in 14 years old kids can order hard liquor at restaurants with friends and nobody cares. funny enough when i moved to the us at around that age everyone made a big deal out of alcohol, as if it s some kind of cool thing to do and people take pride in binge drinking or getting wasted. i thought it was utterly silly, but then i realized kids put alcohol on a pedestal because it was rare and hard to acquire. i m pretty sure it s the same thing with manual in this country. in my home country even car enthusiasts overwhelmingly prefer automatics for daily drivers.",0.9201,positive
lucid,,3,"i m pretty sure that speed limits in germany are rigorously enforced. i m also pretty sure that any car that can reach, say, 175mph will do as fine as one that can reach 200mph when both are traveling 120mph. also, where can people legally drive 120mph outside of a race track or the autobahn? bothe of which account for an infinitesimally small percentage of car usage. we may as well be talking about how well these cars drive on the moon.",0.9349,positive
tesla,Model S,27,"hey guys, no one buy any of their cars, until they sell a bunch of cars.... read back what you wrote and explain how that works.",-0.296,negative
tesla,Tesla,3,"i drove the model 3 and y. i have been in the x and i feel like it s the best tesla has to offer. the y is significantly better than the 3 though. i don t hate the cars i just think they have work to do to get to where i feel like they should be. the acceleration and battery range is impressive on its own, the manufacturing issues are more my problem and the crazy cost to fix with such a technologically advanced car. i think the best option for tesla is to sell their battery technology to other auto manufacturers so that we can get the best of both. but idk i m just some dude on a reddit post. appreciate the feedback.",0.8959,positive
tesla,Model S,-1,too bad it still looks like a 300k toyota crown,-0.25,negative
tesla,,9,why do you believe something that has no evidence?,-0.296,negative
bentley,,9,"2014 infiniti q50. if there is a really cold night like there is here in canada in february you lose all power steering until there is a warm enough day in spring. i kid you not. after a few years of this madness i finally figured out that if it ever happens i can trick the car into thinking it s spring by aiming a heater at the front bumper. again, i kid you not. otherwise it s the most reliable car i have ever owned. edit there was a recall back in december, 2023 after the first cold night of the year to update a sensor and the associated software for this so called steer by wire das system. it never worked for me. after the warranty expired i was quoted 7000 for a fix. i declined. the space heater i now use to clear the fault whenever it happens cost only 50.",-0.4042,negative
ferrari,,29,"chinook scenic byway is fantastic if you go there early morning without traffic. during busier times it gets packed with slow moving suburus and campers and it sucks, but if the road is empty it s breathtakingly good. chuckanut drive is also really good for an early morning drive. then there are roads around snoqualmie fall, and again, go there before the slow traffic show up. i love the roads around here, but i hate the slow and terrible drivers around lol.",0.8312,positive
ferrari,,22,there are rumors of a 24 cylinder mercedes engine but it s not clear to me if it ever existed.,-0.4168,negative
ferrari,Ferrari,298,"a few things first, why did you choose to drive it 38,000 miles in 2 years a lot of fucking driving if it was so horrible? second, you can t say x tires replaced in 2 years because years isn t a reasonable way to measure something that is sold with a mileage warranty. with respect to the mileage, the manufacturers are quite clear what their respective mileage warranties are and they re quite clear that when you run staggered sizes different front and back the mileage warranty is cut in half. any complaints about the tires should be directed to your mirror since you purchased them and knew, or should have known, they would be worn quickly. third, the overheating and wheel issues are fairly well documented. some folks get relief from their dealers some don t. it often depends on the personalities of those involved. fourth, the shorter than warrantied life of your tires, clutch wear, and other issues with the car strongly suggest that you rode it hard and put it away wet. the magnarides on my cts v far heavier than your corvette are still going strong 70,000 miles and 7 years on most others have similar experiences. the rallies suggest hard driving as well. none of that is conclusive evidence, but there is a pattern of wear and tear on your old corvette that is not normally seen on c7s and that strongly suggests user error s . fifth, why is it gm s fault you took a loan our on a car and were upset when your high mileage car was only worth 4,000 more after you did a firesale rather than looking for the best price. you chose to sign the deal on a car you didn t need. you chose to drive it 38,000 miles in 2 years. that is actually pretty tame depreciation by most standards. the guy i bought my exige from was paying 1,700 month and 3 years later he had 1,400 in equity. yes, one four zero zero. you wanna be a big boy with a new corvette? be a big boy and deal with the depreciation curve that has been established for the last 30 years on corvettes. go put 38,000 miles on a new ferrari or lambo and get back to us on depreciation. go put 38,000 miles on a high end mustang and get back to us on depreciation. go put 38,000 miles on a german sports car that isn t a gt2 3 and get back to us on depreciation. finally, the fact that the dealer didn t want to buy your car for auction value speaks volumes. i am actually surprised that you included that fact. frankly, it sounds like they simply didn t want to do business with you for any reason, even though there might be a profit in it. i ll let you reflect on why that is and whether it has anything to do with my points above. cheers.",0.9845,positive
rollsroyce,,177,,0.0,neutral
porsche,Porsche,6,"the ring only has track days a few days per month, so even locals who do track days will also get in a few tf laps. not necessarily someone being cheap. also the case that not everyone can make their schedule work with the track days. sometimes people who do euro delivery of porsches and bmw s will do a tf day before they drive home or put their car on a boat .",0.0,neutral
lucid,,4,"is the m5 the only big engine phev people have ever heard of? evs are generally lighter than phevs like this. i can name the m5, the panamera, the amg gt 4 door, the s580e, the flying spur, the continental gt. the panamera, amg gt, and conti gt are around the m5 s weight, with the s580e and flying spur being significantly heavier. meanwhile i can t think of a single mid size or larger phev with 6 or more cylinders that s meant to commute on electricity alone that s under 5,000 pounds.",0.5719,positive
