brand,model_hint,score,clean_text,sentiment_score,sentiment_label
rollsroyce,,60,"i underwrite specialty loans for high net worth clients. they take out equity lines on their homes that are sometimes 1 2 million or more, our max line is 10m. the interest rates are great, especially with all the relationship discounts applied. i ve seen them as low as 2.750 . most of these people have millions in liquid and retirement assets, but it s better financially to use someone else s money if the rate is cheap than burn up large chunks of your assets in one go",0.8658,positive
bentley,,12,"best looking premium suv, land rover rarely has a miss when it comes to design.",0.6852,positive
tesla,Model S,50,the king? you literally skipped the taycan. that s the king also obviously ea doesn t work. telling a company to build a nation wide infrastructure as a punishment was never a good idea when they had no intentions of maintaining it,-0.7786,negative
ferrari,,15,"porsche is up there in reliability on the other hand. my dad bought a 2006 base model cayman brand new. he daily drives it, has out over 250,000 miles on it, and it still runs great. he did have to replace something maybe the water pump? that required an engine out service. it cost somewhere in the neighborhood of 10,000 but he hasn t had any significant issues since. so sure, they re expensive to maintain, but it s not like they re breaking all the time. porsche is the only luxury sports car i ll probably ever consider purchasing due to this.",0.8004,positive
tesla,Model S,1,"sometimes i think we may be headed for a 2021 inventory supply shock with all the reduced trade from tariff shocks. with tesla increasing prices on top of losing credits, and their outdated and partly obsolete lineup, i can t help but feel the lucid gravity at 100k is actually a great deal and i shouldn t let my reservation go to waste even though i absolutely do not want to take another massive depreciation hit on an ev anytime soon. but a lucid gravity is greatly better than a model x with only a marginal price difference",0.6866,positive
bentley,,3,"i m a pretty big believer in synthetic fuels, despite the huge amount of skepticism they receive both on this sub and by ev fans. evs will obviously play a huge role in the future of cars but i don t see a reason for the internal combustion engine to die off completely if there are fuels that they can run on cleanly. ev batteries were once expensive and impractical, but are now viable for the mass market. i think that alternative fuels will follow a similar trajectory. over time production of these fuels will likely become cheaper, more efficient, and less complex, as it does with any new technology.",0.0666,positive
porsche,911,6,"a friend of mine briefly had a 74, but way back then, parts were extremely painful to source in the states, and it needed a few. it s been so long, and he had it so briefly, that i can t reliably recall if the shifter linkage was an issue or not. the alleged rear seat was more memorable, being notably less generous or usable than a 911. it went to a fellow who was going to strip it out for scca racing. it never occurred to me to buy it at the time, our crowd being mostly into modified fast pony cars, but in recent years i ve found myself wondering if my preferences would have changed earlier if i had.",0.2074,positive
rollsroyce,,18,"man, this thread makes me nervous. last year after buying my car, i got a letter from dodge mentioning there was a solution available regarding anyone being able to make a key that matches the car, so i ended up taking my car in and they locked down the ecu. not sure if there is a way around it. i guess just take the payout and either try again third times a charm? or look into an alternative, though i know firsthand the amount of performance sedans out there that are anywhere near the price of the scat pack are basically non existant.",0.2354,positive
tesla,Tesla,17,lucid gravity charges faster on tesla superchargers than any current tesla model lol. what a joke.,0.4404,positive
ferrari,,4,yeah i m out of space so only one modern sports car. this is my first cayman though and i love it.,0.7506,positive
bentley,,11,,0.0,neutral
ferrari,,35,good thing it s faster around corners too.,0.4404,positive
ferrari,,9,been meaning to trade in my f150 for a car. might just make the switch guys,0.0,neutral
tesla,,3,atleast savagegeese is fair in their reviews. the latest reviewvertisement actually had a big of negative things to say about the gx,-0.34,negative
porsche,,34,"yep. the dealer i bought my stinger from was excellent. never once pressured me maybe because he could tell i was already sold before i even walked through the door , never gave me any trouble with a test drive, never fed me bs info and answered any and all questions i had. the sales process with them took about a month was waiting for the one i wanted to show up in their inventory before i was ready to commit and they were never pushy. that being said, i ve heard far too many of these stories to believe they are just rare anomalies, and our purchase of a 2014 soul a few years ago wasn t quite as laid back still not too bad though .",0.9048,positive
bentley,,20,one of my favorite articles every year. very excited,0.6901,positive
tesla,Model S,-2,who cares. let me know when it can go 500 miles and charge to full in 15 minutes.,0.4588,positive
tesla,,4,"the stock obviously also grew in the meantime. if it s now worth 20, and paid 50 in dividends over the time you held it, it just would be worth 70 now otherwise. investors aren t dumb. if it didn t work like i described, then buying a stock just before the dividend cutoff date, and then immediately dumping it after the dividend is paid, would be free fast money. if you have a stock worth 100 that pays a 3 dividend, what happens in a vacuum is that on the dividend cutoff date it is going to fall to 97. then, over the course of the time until the next dividend cutoff date, it s going to steadily grow back, and repeat the cycle, since this is just the expected value of money over time. a stock with no dividends will just constantly stay at 100. of course, in real life there are hundreds of other things happening every day that affect the stock value, so it s never just exactly these things happening. but they re happening on top of everything else that happens.",0.6652,positive
bentley,Bentley,17,"completely different engineering goals. the bentayga doesn t have to nor need to go off roading. it s got the systems on the car just..because they can. the entire point of the trx is to be traveling at high speeds off road. and showing girls the same age as your step daughter that you can take them to places they ve never been. yeah, the bentley will get you to the ski resort every time. but beyond a snow ice covered road that s only halfway plowed? it s owners have other cars to do that.",-0.1139,negative
porsche,911,3,agreed. i ve owned all sorts of 911s and caymans. loved the turbo but it s like an ev these days. used to be a fire breathing monster but has been tamed by traction control and nannies. i ll take a 996 997 manual turbo any day.,0.4854,positive
tesla,Model S,7,that s because dealerships are smoking crack and letting them rot on dealer lots. that s what took me out of looking at a manual scat pack widebody when i was car shopping last year i wasn t about to pay big money for a stripper spec scat pack that didn t even have the nicer sound system.,0.3612,positive
porsche,,9,if they could just fix the c8 steering feel it would be perfect to take this on. as it is i ll buy a loaded m4 before this i guess. i need the rear seats anyway.,0.5719,positive
rollsroyce,,122,,0.0,neutral
rollsroyce,,8,,0.0,neutral
porsche,Porsche,20,,0.0,neutral
bentley,,20,seems like a 12 pot isn t the best for city driving who knew,0.7717,positive
lucid,,20,,0.0,neutral
ferrari,,6,"this. not everybody is rich and has the means to buy an amg, a m, an rs or whatever top of the line model. if i was an m car owner and i saw somebody with a toyota camry with a m badge, i would just smile and continue my day. he is aspiring what i have. he payed for his car, he may do whatever he pleases with it as long as it is legal. if i was the toyota camry owner, and i had the means ti buy the m car, why would i not buy it? but like that i get to own an m car like car...doesnt bother anyone, except some grown ass kids having no bigger worries than a badge on car.",0.0351,neutral
porsche,,3,"now this may be a bit of doom and gloom, but this might result in the end of the hypercar. when your 2000 hp hyper ev car drives essentially the same as the everyman s city car which can do 0 60 in 5 seconds, like the upcoming kia ioniq5 or telsa model 3 , but is less practical, and only faster on a runway, what s the point in spending literal millions on the car? looks? that s all that s left. but, off topic, the wide, low, mid engine look was designed out of necessity in the 1960s to get more performance out of race cars when front engined, rear dirve cars weren t fast enough. making an ev with the same shape seems limiting. i think the ev technology should be an opportunity to rethink the car s shape, while still keeping the tear drop aero efficiency.",-0.6608,negative
rollsroyce,,12,"dc fast charging can absolutely be more expensive per mile travelled than a fuel efficient gasoline car. the closest tesla supercharger to me is 0.51 per kwh. with my model 3 s efficiency at 4 mi kwh, that results in a cost of 0.13 per mile. a prius that gets 50 mpg and with local gas prices at 4.65 per gallon has a per mile fuel cost of 4.65 50 0.09 per mile. which is less than my model 3 s cost when using a supercharger. dc fast charging is not cheap and really should only be used for road trips. all of the savings you get from driving an ev come from charging at home or somewhere else where you re paying typical electricity rates. for reference i pay 0.18 per kwh at home, which gives me a per mile cost of .05. many people just assume fast charging will automatically be cheaper than buying gas, but dc fast charging requires a lot of expensive electrical infrastructure and that cost has to be recouped somehow.",0.3506,positive
ferrari,,19,a drag strip is a very typical track on which to race.,-0.2263,negative
lucid,,51,"in some ways it s kind of neither and both. i think of minivans as fwd based, lower to the ground, and with sliding doors. but suvs traditionally also had an off road aspect to them, hence the utility side.",-0.1531,negative
rollsroyce,,3,"agreed. despite people s distaste for the old ones, i thought the grille looked good on their cars and passable if a bit oversized on their suvs. that body color, gradient texture stuff they re doing now is utterly horrible. however, i m not buying a lexus suv ever, for any reason, so i guess it s whatever the actual buyers want...or will tolerate.",0.0534,positive
rollsroyce,,6,my buddy was an insurance adjuster for a major insurance company. they carried insurance for this kid. normally would not have provided coverage but they have a policy that provides coverage on a new vehicle for a couple of days until they have a chance to process the policy. this is for people who already have their insurance. the company sued the dealership. they sold a hayabusa to an 18 year old new rider. fatal accident less than a day later.,-0.8126,negative
rollsroyce,,23,this kind of thing has cartel written all over it. there is nothing you can do about it because no one in mexico will help you. but obviously they have people in the u.s. working this and that s where the feds should come in. of course quite possible that they re already investigating it and just waiting to pull the trigger on indictments. if you want to be sure your 400k rr gets from phoenix to atlanta...drive it yourself or have your guys drive it.,0.5647,positive
tesla,,8,"its something you see more on higher end or luxury cars than on economy cars, for sure. it helps to push the lower point on your steer axis further out without having to actually put the physical joints deep inside the wheel. this helps more with strut suspension since that usually puts the upper point on your steer axis pretty far inboard. if you mean why not put a physical ball joint at the intersection point, the advantage is mostly packaging although there will be dynamic differences as well because the virtual ball joint moves as you steer. sometimes it may not be possible to put a physical joint at the desired location at all. then, if the alternative is to have the lower joint further inboard, there are a lot of reasons why you may or may not want to do that, it gets complicated to answer because it depends on the rest of the design.",0.9228,positive
ferrari,Ferrari,101,,0.0,neutral
tesla,Model S,-6,"does a tesla x plaid count as fast? sure, it accelerated fast, but they have no soul.",-0.2846,negative
tesla,Tesla,9,"i feel like you re missing the patriotism good ol boy angle. the whole thing is that a tesla represents the coastal elite with electric cars and high gas prices, etc., whereas a big 3 pickup represents traditional american automotive values. that s a big factor in the truck market, and it s why ford, chevy, and ram each individually outsell toyota, honda and nissan combined. tesla isn t getting rid of that stigma quite yet. i personally wouldn t buy one because i don t like the snobby reputation among the owners and because i like hearing the engine when i hit the gas. i bet a lot of truck buyers feel the same way. if alternative designs and philosophies worked in the truck market, then the honda ridgeline would be selling well. it s not, and honda has a shit ton more experience than tesla when it comes to cars. you think tesla is gonna somehow do what no company has been able to do and challenge the big 3 when it comes to trucks? unlikely.",0.5859,positive
porsche,,18,"this is because they released the cheaper v8 variant, the comparable w12 variant to the 2003 model was approaching 200k",0.0,neutral
tesla,Model S,1,"what are you even talking about? these things can definitely handle the power. tesla brakes are super robust. there isn t even a data point suggesting they crash more than anything else. i don t even like tesla, but this is just dumb.",-0.1406,negative
tesla,Tesla,4,"i would guess that handling would have to be better than a traditional truck due to all of the weight being so low in the vehicle. still not model s handling, but i m sure it ll be better than an f150. also it has air ride suspension that can lower it on the road. in the end, people aren t going to be carving up canyons in these things. and if other tesla models have taught us anything, once they see their range plunge, they won t be launching very hard all that often either. tesla kind of manage themselves in that regard. one hard launch to 60 might erase a quarter of your range. and if you charged at home, that might be a couple of hours worth of charging.",0.8243,positive
lucid,,7,i think there might be some structural support reasons. a beefier d pillar is more rigid. also will say i disagree and think the window opening and the roofline deviating is perfectly fine and a nice design gesture aesthetically speaking.,0.7968,positive
tesla,Model S,1,how will it be heavier than the hellcat with a lighter chassis and lighter engine. the other internals would have to be heavy as shit to make up the difference and surpass the weight of a hellcat.,-0.5574,negative
tesla,Model S,36,extreme customization is buying mild body kit package from a tuner company?,0.0,neutral
porsche,,10,if anything america has shot themselves in the foot.,0.0,neutral
tesla,Tesla,18,i don t care how you store it it will never be 100 safe. energy has potential. this is the fundamental problem we are fighting here. there will be more and less safe ways that come along but storing enough energy to move 2 6tons 300 65mph is in its own way somewhat inherently unsafe. ice cars don t look good when they crash well enough for a full tank of fuel to get ruptured and ignited either. just doesn t make the news as omg tesla so unsafe.,0.5834,positive
ferrari,,27,"i disagree with the methodology here. if the whole point of the data is real world passing situation where the car is cruising at 40mph to start, subtracting the two times is not accurate, especially so for turbo cars, and doubly so for small displacement engines with large turbo chargers. this is also obviously ignoring any downshift that would need to take place to come close to these numbers. this can be easily demonstrated by looking at the difference in 5 60mph times vs 0 60mph times for any given car.",-0.4404,negative
bentley,Bentley,3,,0.0,neutral
porsche,,9,"if you lose out in us eu china, that s like 70 of the world car market?",-0.0516,negative
tesla,Tesla,4,,0.0,neutral
porsche,,9,"that s the way american dealers handle things. they cheap out on everything to save a dime instead of helping their customers. they don t even realize that is screwing them in the end game because it makes you feel like you don t wanna come back and do service with them if they treat you poorly. on top of all that, the service advisor didn t even know what the hell he was talking about. sa s are literally worthless and i never really take anything they say seriously because 90 of the time, if they re an sa in a dealership, they just do it for the money. they don t have a passion or knowledge for cars, they re just the purgatory line to spew bs at you and try to make you happy lol.",0.8689,positive
bentley,Bentley,10,"maybe a title that says, bentley, porsche, rolls royce sales plunge in korea after green plate rule ? ...but that won t get as many upvotes would it?",0.7514,positive
ferrari,,12,"the ground clearance is one of the most supercar y things about it. watch out, sterrato and dakar.",0.0,neutral
bentley,,27,"goldfinger, the original movie to feature one, was a huge success. couple that with years of bond driving a db5, and that s it. the legend has been made. aston was probably considered bond s car even when he wasn t using one in his movies. also, aston came back with a db5 for goldeneye, which came out in 1995. so did tomorrow never dies. the world is not enough is the only brosnan movie without an aston martin and there has only been one bond to never drive one, roger moore.",0.8074,positive
ferrari,,3,"it doesn t need to be linear this method is perfectly accurate. the time a car takes to go from 0 80 is exactly the same as the time it takes to go from 0 40 plus the time it takes to go 40 80. this isn t the same as the time it takes to go 40 80 if you start at 40 and nail the throttle, but it s exactly the 40 80 time you d see if you just time it from 40 80 during an acceleration run",0.3818,positive
lucid,,145,i can t believe we re still talking about out nikola after it s ceo was found to be a fraud all those years ago. is that zombie company finally dead?,-0.8442,negative
porsche,911,3,"i ve had offers that were close, but five figures is a bit high. most of the value as it sits is in the parts there s a lot of rare stuff that only fits very early 911s, and many of their owners would think nothing of dropping several thousand dollars for a good parts car. that said, even 912s have risen a lot in the last few years, riding on the coattails of the swb 911 craze. the only difference between the 912 and 911 is three gauges vs. five gauges, and the super 90 4cyl engine vs. the 911 6. all of the mounting points and such are identical.",0.9152,positive
rollsroyce,,3,1992 buick park avenue with air ride enters the chat literally a leather sofa strapped to the best v6 on earth,0.6369,positive
rollsroyce,,3,"also watch out for relay attacks used to relay your key fob signal to your car making it think the keys are right next to it. this can happen when away from home too and not just in front of your driveway. use a faraday bag or box to prevent this. checkout our diy faraday box video or faraday bag video for more on that. also, note that if your vehicle has bluetooth capabilities to use your phone to unlock lock start your vehicle then stop using that feature as relay attacks on this are also coming out now. there s no way to stop this other than disabling the feature.",-0.9246,negative
rollsroyce,,17,"oh, my sweet summer child. cars have been capturing data and communicating back to their respective home offices for over a decade. a coworker s wife has an older bmw, and when the car measured any service lights, time for an oil change or tire rotation, etc. it would send that back, and the dealer would call her. they would tell her that her bmw called them and notified them that it was time for xyz, and when would she like to come in and have it handled?",0.8074,positive
porsche,,50,"and or op s numbers are completely off and the conti gt was 150k at launch, in 2003, 22 years ago and the a8 is still under 100k, and it is not the same thing as a conti at all",0.2732,positive
ferrari,,24,"i completely get your opinion as well. i made a couple sweeping generalizations to make a point, but you re absolutely right. the 4 cyl ultimately isn t for everyone, but i find that lots of people end up liking it quite a bit once they try it. i m glad you love your 4.0 though, if i had another 40k on top of what i paid for my gts i would ve gone with a 4.0. edit went to your thread, some of your complaints don t apply to my gts 2.5 experience. i have sport pasm spasm lower 10mm was an option on gts 2.5, but is standard on the 4.0, while normal pasm raised 10mm is an option on the 4.0 and leather interior. the gts 2.5 has slightly different power delivery and sound than the s due to different intake manifold and a different turbo compressor. there s still turbo lag, but just wanted to mention those things. your experience is still valid, but felt the need to mention that the s is slightly different from the gts 2.5 to anyone reading",0.8248,positive
bentley,,10,"the 1989 supercoupe, where to begin.... the headgaskets were the most common failure point on this car. on the bright side i now know how cars work. on the dark side i am now enslaved to the milwaukee lifestyle and auto zone knows me on a first name basis. to access the passenger side spark plugs you need to go underneath the car and reach up between the exhaust and the subframe and feel around blindly. topside access is impossible due to fuel lines, electrical harnesses, the throttle body, coolant lines for the heater core, and the engine lift point. seriously, google that engine bay. there s a v6 engine in there somewhere, i promise! the power steering pump had a hnv bracket that mated it to the water pump, so you had to use a pulley puller to pull the power steering pully to remove the hnv bracket if you wanted to take the power steering bracket off a lot of owners never put them back on to take the water pump off you need to take the harmonic balancer cover off which is secured by the bottom waterpump stud which is a blind stud as the crankshaft pully is there. oh by the way, the crankshaft pulley is there, so you can t take the cover off without pulling the crankshaft pulley... or you can do what i did and just cut a notch in the cover so it could rotate clockwise to not block the stud. it has a solenoid that controls boost pressure for economy reasons and it is the second most common failure part. if it goes out, no more boost. you can bypass it with a 20 cent barbed junction and now you have boost at all rpms. automatic seatbelts. really, the further into the weeds i get with fixing this car the more i understand why so many of them ended up in junkyards. i just replaced the motor mounts and intake manifold gaskets again because the haynes manual has you torque to 11 ft lbs but the forums guy say 23 is the minimum otherwise it leaks last month and when i went to start it it blew a fuel line along the firewall.",-0.4201,negative
tesla,,5,"wonder what happened, i don t follow the chinese scene but remembered it was very popular and up and coming 2020. is it more of a luxury brand and pricing and the chinese market has not taken well to higher price points in general? looks like they re starting to enter the economy car market more recently. also wonder if because the battery swap idea isn t panning out. u cookingboy any commentary on the chinese ev market?",0.76,positive
ferrari,,19,yes. the biggest example of this is apple records suing apple computer over the name apple. apple computer won and was able to keep its name because people were not likely to confuse a computer with a music company at that time . itunes blurred those lines and i m sure money changed hands later on to pacify apple records when itunes was furiously proving apple computer is a successful music company as well but the earlier landmark case demonstrated that a name isn t enough.,0.7255,positive
ferrari,,24,that s an incredibly marginal refresh. more of a facelift than anything.,0.0,neutral
tesla,,6,,0.0,neutral
tesla,Model S,140,"good quality lcd displays have gotten dirt cheap. with everything being networked in a modern car, it s cheaper to program a ui than it is to build a physical button. i don t think it would be as common as it is without tesla. they proved to everyone else that you can still sell cars without buttons. i worked for mercedes benz until about 6 years ago and their engineering dept. was extremely anti touch screen. here we are in 2023 and they re giving all their new interiors the tesla treatment.",0.079,positive
tesla,Model S,10,so anyone who brought a new s or x last month or so just got taken to the cleaners...,0.0,neutral
