brand,model_hint,score,text
ferrari,,58,"I own an Autozam AZ-1.  I have access to a lot of supercars.   *Nothing* attracts attention like that thing.  You'll get to park up front at every autoshow.  Every trip becomes an event.  People will bother you at stoplights, in parking lots, pretty much everywhere.  It looks like a toy and everyone wonders how it can be street legal.  It looks fast and has gullwing doors.    It helps that the car is approachable.  People don't assume you're an absolute d-bag or pretentious rich person who won't have any time for them.   I won't drive it if I'm not ready to be a rolling sideshow.   A good alternate is a [Morgan 3 Wheeler](https://www.topgear.com/sites/default/files/2021/06/TopGear%20-%20First%20Drive%20-%20Morgan%20-%203%20Wheeler%20-%20027.jpg?w=1784&h=1004).  That is also like wearing a Halloween costume on a random Saturday in May."
bentley,,9,"Red plates on fleet vehicles in CO. It's great knowing exactly who to avoid, especially in winter when conditions are variable and there's a fuckton of ski tourism."
lucid,,33,They do have a deal with Aston Martin to basically supply them with all of their tech.
ferrari,,6,"Lol, you ""China bad"" bots are 10 times more annoying.  Can't accept that China does something good."
rollsroyce,,12,"Mexico directly would make things complicated.  As Ed Bolian explained, it's more like the car is in Salt Lake City, and you're in Miami.  You buy.  They tell you 5 days.  The scam broker double brokers it, and it's dropped off by a legit broker in LA in 2 days, on a random road by a dealership, which looks normal.  The thief picks it up and has a couple days to sell it to someone else with a fake title, reVIN it, dismantle it, etc any of which might then have the car going to Mexico."
porsche,Porsche,48,Hanging out in Porsche crowds they aren't too happy about spending nearly 300k on a gt3 A lot of the guys have been around for a while and don't appreciate a 30% price increase in just half a generation
porsche,Porsche,22,"Quick article. http://autoweek.com/article/24-hours-le-mans/why-did-no-5-toyota-ts050-stop-5-minutes-left-24-hours-le-mans  Summary Toyota was winning 24 hours le man's, with a commendable lead. Second Japanese team ever to potentially win. 23 hours 55 minutes in, faulty air lines in their vehicle leads them to sit out the last 5 minutes and Porsche takes the win.  Video of summary. Mind you huge battle between the two cars. https://youtu.be/jOSNEGYJWus  Porsche tweets. ""Competed together for 24 hours. Head to head for 24 hours. Gained our respect forever. #LEMANS24"" https://mobile.twitter.com/Porsche/status/744572580380696576  Official Porsche victory video. With quote and highlight. https://youtu.be/6q5n4yECqm4"
tesla,Tesla,15,You're both saying the same thing: Tesla is overvalued.
tesla,,39,"The only critique I have with your breakdown is the title. I run a Taiwanese factory with suppliers across most of Asia. It is not in the least ""unbelievable"" to see a Chinese company racking up supply chain debts and slave working conditions. Most Asian manufacturers juggle payment terms, government supported funding and zombie loans (basically loans that only ever pay interest and gets extended indefinitely) to stay afloat. I spent the past five years transitioning away from those three things because COVID hit us hard and nobody thought we'd ever survive it. If the global manufacturing chain was forced to an American style of capital and currency management we'd all end up with sackcloths and typewriters."
tesla,Model S,-1,"I guess the saving grace is that the poor engineers at Tesla have to fulfill whatever ridiculous promises Elon makes. So even if Elon is bullshitting, someone in the background has to make it happen."
tesla,Model S,2,"Not a fan of EV at all, however that is majorly impressive, considering the 720s is a rocket and runs a bit behind.  The weight difference is huge."
bentley,,18,"The End of the Seat brand is said to be a possibility, not a must. Looking at recent Seat concept cars I guess they are aiming for a new brand identity including a new name, because the old one is connected to cheap superminis in most peoples minds. According to Herbert Diess Seat is only selling well in Spain, Germany and the UK.  The duality of two entry-level brands made sense in the early 2000s when Skodas were blunt and conservative looking transportation devices and Seat the fresh and spicy brand for younger folks. Both were aiming at totally different customer groups, but with all cars (even Skodas) becomming more ""sporty"" (looking) in the last decade and both Seat and Skoda developing fully grown model ranges, they ended up directly competing each other.  I never realy liked the design of Skodas, but looking closer at them they remind me on older VWs from the 80s and 90s before VW moved up-market. A bit generic looking but very solidly made cars that were just plain cars. But I guess just isn't enough anymore in times where most cars of most manufacturers become more and more simular. ""Brand identity"" is often the most significant difference between competing models nowdays, especially within the VW family."
rollsroyce,,4,"Middle lane huggers are the worst. I rarely drive left lane, because my girlfriend's Citroen barely makes it to 180. So I'm usually cruising middle lane going 130 to 150. Then comes Harald Müller in his Opel or Dacia overtaking a truck on the right lane that goes 90 by going 100 himself. So it takes more than 2km for him to overtake the truck and you can't pass him on the left because Justus Von Arroganz is going 280 in his BMW/Porsche/Audi/Mercedes."
rollsroyce,,56,"I had a championship white ITR. It is a car I both miss and don't regret selling, as the theft issue with them was crazy. Had it for 3 years and was always worried driving it anywhere, but it was an amazing fun ride. I think I still have the factory Type R wheels in a shed somewhere. Of all the cars I've had, this is the one I would love to get back, just because it was fun. Not the fastest, but just a pleasure to drive. Now I drive a 1000+hp c6 z06, and miss the days of fun without needing 500+hp."
tesla,,11,It’s been 8 years since the Roadster 2.0 has been announced and it’s still just vaporware lol.
ferrari,,5,"Forums were really the golden age of Internet car culture.  We had every issue or parts review archived and searchable.  A few I was on had diy and knowledge base articles neatly indexed to basically read and learn everything you need to know about common issues and fixes and mods.   We had forum meetups and cookouts and karting events and stuff.  A lot of times these people became lifelong friends and like family.   Shout-out to Honda-tech, the GranTurismo.com forums, VWVortex, turbo-mopar.com, turbododge.com"
porsche,,45,"Sigh as someone whose backup is a beige 99 Camry I will tell you maintaining a car that old is not cheap. Especially once you hit 200k miles on it, all the big time maintenance done 100k miles ago have to be redone, everything from the spark plugs to the timing belts and even suspension in some cases. It actually would have been more economical to just lease a new Corolla over 4-5 years than to redo the long term high mileage maintenance over the same period of time."
bentley,,23,"Trust me, car manufacturers aggressively cut any feature, no matter how cheap, if it didn’t hurt the sales of the car significantly"
ferrari,,5,Not sure what time the 787B has done but best I could find online was around 1:20 something. The McMurtry's best time so far seems to have been set by an amateur driver who wasn't going for a record and in a car running at 50% power and 50% downforce so I'd imagine it could go quite a bit faster (probably enough to trouble the overall lap record). Even so it did a 1:18 so about 10 seconds off the Indycar record.
ferrari,,11,Lol the China bots wasted no time getting in here
ferrari,,62,"My parents did spoil the fuck out of me and bought me the first vette. I had a falling out with them because I disagreed with their values. I paid for my college degrees and all the other cars and living expenses on my own. Haven’t spoke to my mother in almost a decade, even though she lives 10miles from me. So, buying supercars is easy when you have 4 college degrees, no house, no kids, no savings, and only take car-related vacations."
tesla,Model S,7,Uhhh everyone I've met that owned a charger seemed to care A LOT about what everyone thought of their car.
lucid,,17,"Base is $77K but it's super stripped down. No adaptive cruise control (it's an option). No sunroof/moonroof/glass roof and you're not allowed to option one unless you go for the higher level trim. One choice of interior color that you better love. Some stripped down audio system. Basically take out any normal features you would expect in a car that's going to be $80K with taxes and that's the base trim. They clearly don't want anybody actualy buying it, the Touring trim is the first trim that has normal luxury features and it's $20K more. Honestly if your price limit is $80K you're better off buying something else, because that super stripped down base vehicle makes no sense."
porsche,,212,"FT86Club: which Valentis do I get? Also, any way to remove torque dip without spending any money on parts and tuning? Can anyone send me wheel and drop specs for perfect flush fitment bro thanks  NASIOC: STAGE FUCKING 8 BROOOOOoooooo DOWNPIPES DECATTED BROooo VF48 WRX SWAP STAGE 6 CLUTCH SO I CAN DUMP IT guys is this sound rod knock? How much to rebuild the block? Are headgaskets easy? How much oil are you guys burning mine ran out of oil to burn  S2KI: The Ferrari 599XX Evo is cool, but it barely even has the HP/L of the S2000. I wouldn't trade my S for one if money wasn't a factor.  CivicX: Does putting on a Type R wing on my EX/Sport/Si make me a ricer? I only want to put on the red Honda R badges, the R wing, the R vortex generators but I don't want to look like a wannabe Type R."
lucid,,20,">	or the midsize specifications themselves grew bigger.  It's this one. I dont know how an E Class can be considered a full class sedan when the S Class exists. What's the S Class now then? Extra full class? The C Class/3 Series/A4 are compact sedans, E Class/5 Series/A6 are mid size, and S Class/7 Series, A8 are full size. If the definitions of car classes don't grow as cars get bigger then eventually there will only be full size sedans."
rollsroyce,,3,The interior reminds me of an Evo or a Subaru.  You buy a $40k drivetrain and they throw in the interior. The tech is meh on me. I would want some sort of HUD instead of having the center screen like a Mini or Beetle had but it's just a way to cut costs.  I do believe the model Y will be the better model X. I don't see why not to get the dual motor with longer range though other than cost. If they would have a higher performance Model 3 RWD then I would see but it does remind me of a Civic like you said and not an SI
tesla,,3,The new 21-inch wheels are contenders for the absolute worst OEM wheels. The previous Arachnid wheels were good-looking
rollsroyce,,11,"I'd love to see some size comparisons with a square body GM or an OBS Ford.  Those fuckers are huge, every time I stand near one I'm mentally expecting it to be (or at least feel) smaller than my modern truck and it takes me off guard how big it actually is.  ~~People~~ redditors in general are a bit lost when it comes to historical vehicle sizes.  Same thing with the ""modern cars are bigger than they've ever been before"" nonsense.  Sure, maybe if you pretend no cars existed before like, 1973, when America started to embrace compacts.  Go look at the size of a 1941 Ford coupe -  it's the same length from front to back as a Toyota Highlander and the same height as a Ford Edge."
bentley,,7,"An immediate family member of mine has a G70 with the 3.3T. The car has its ups and downs. Its a great car, but it is not without its quirks. The car has done about 30k miles in 15 months, and it's been in and out of the dealer for rattles and squeaks that seem to come more than they go.    You are spot on about the dealers though. The dealer that ours gets serviced through is definitely more of a hassle than is liked.   The other issue is that the engine has the well known valve tick now. If the car sits for a day or two it sounds awful on startup, but it gets better after its warmed up.  After 4 days at the dealer they said it was fixed but nothing changed. Just hope it doesn't grenade right out of warranty.   Overall it is a fantastic car, the power and features are great, and the pricing is really competitive against its rivals.  I think the dealer issues are whats going to plague the brand until it get sorted out."
bentley,,3,"Cars have *terrible* acoustics. You can throw as much money as you want at it but you can't get around the size and shape of a car along with the materials involved. I would honestly make the claim that a ~$1k home speaker setup will beat any in-car audio. Hell, even my headphones (HD600's + decent AMP/DAC) beat any car audio I've ever heard, and it's not even close. That setup is something most people could achieve for ~$4-500.  When it comes to cars, as long as the quality isn't horrendous, I don't really care. It will never approach my home setup, so I wouldn't be interested in blowing additional money on it. For me, a car is not an environment that I go to for a hi-fi listening experience."
tesla,Model S,2,"its not a sports car, more like a sports SUV"
porsche,,3,"Could have been testing some new interior designs for a different vehicle. Was pretty common.  GM also used to use some of their cheaper basic cars for very bonkers projects. Their Beretta coupe had a turbo v6 in one mule, an Isuzu v8 in another, and an all wheel drive v6 system in a third. There's also rumors of them throwing the shell over a rwd chassis to test a small rwd vehicle, but that's just a single paragraph in an old car magazine."
rollsroyce,,132,I had to check halfway through that this wasn’t a shittymorph
porsche,,149,"Jeep forums vary widely.   New Jeeps:   What floor mats should I get?   Why does anyone waste money on Warn winches when my Smittybilt is just as good?  What's your opinion on angry eye grills?  What size Rough Country lift do I need to clear 37"" tires?  Older Jeeps:  What junkyard seats fit in the Wrangler?  Here's an in depth guide to how I installed a shaved GM 14 bolt!  Hey guys, I cut my YJ in half to make it a YJ Unlimited!  What size Rough Country lift do I need to clear 35"" tires?"
porsche,Porsche,3,"Yea they are one of the most reliable brands. Also I’m not in my 20s anymore, my ego is a bit more in check lol and I don’t need the absolute fastest car on the road. Any of the new sports cars in that range will be plenty fast enough for me. Porsche is a level of refinement way above the rest in class. Plus I love how they have confidence in their classic designs and don’t need to reinvent themselves to go after another market or whatever bmw is trying to do."
ferrari,,3,"VR engines are a pretty cool idea, I prefer the VR5 because it's more symmetrical and 5 cylinder engines sound cool.   I'd love to see a super high performance I5 or VR5, like built to the same spec as the T.50s V12, so a combination of NA, low weight and high revs held together with Cosworth magic. Alternatively a higher tech but less pure version made by Koenigsegg using freevalve and a MGU-H style turbo would also be interesting. Make it as small and light as possible while making 300 or so HP then put it in that affordable sports car Gordon Murray designed but can't be bothered producing (similar to the Alpine A110).   Now I just need to win the lottery. A few times."
tesla,Tesla,49,"Many also think they do, whether that's true or not.  There are a lot of Tesla fans that view owning Tesla vehicles as owning a small piece of the Tesla brand. Unlike the vehicle, whose value can be determined semi-objectively, the brand's value is determined by how many people are *extremely hyped about it*. In that frame, criticisms of the vehicle aren't bad because they make you feel bad about your purchase, they're bad because you might dehype someone listening and therefore devalue the thing they really care about.  There's a reason the overlap between cryptocurrency people and Tesla superfans is so large: you need the hype machine mindset to achieve peer prominence in either camp."
rollsroyce,,41,"Be that as it may, some relatively thorough tests have found some interesting trends regarding range.  Edmunds [finds](https://www.edmunds.com/car-news/electric-car-range-and-consumption-epa-vs-edmunds.html) that on their testing loop, every EV they've tested matches EPA range, or exceeds it by 10 or 15%. Every EV except the Polestar 2, and every single Tesla. In fairness, some of those Teslas are a single digit mile off the EPA rating, but some are also 10 or 15% off. Sure, it's not an EPA test, but when every other EV can match or comfortably exceed the EPA rating....  The Taycan 4S is a ridiculous 60% up on its EPA rating. Granted, not a Turbo like OPs, but still.  Sure, the precise mileage number may be an estimate on both, but it seems that you have a better chance of hitting the rated number in basically anything that isn't a Tesla."
ferrari,,23,In the 90's I was driving an 1984 930 along a slightly off camber long sweeping corner in the rain.  I wasn't giving the car the attention it deserves and I foolishly downshifted. The poo came out but somehow I managed to save it.     I never let anyone downplay the seriousness of the snap oversteer on older 911's and wanted to comment before the crowd of people who have never driven one start commenting about how it was never that bad and a myth.  It's fine on the track when your in full concentration but even the best of us lose focus on the street from time to time or change a radio station mid corner and that's when it bites you.
porsche,Porsche,3,"A lot of bickering about who is at fault, but at the end of the day it will come down to the Police officer who writes up the accident.  They will consider the rules of the road, not the rules of the racetrack.  It will probably be something like 75% BMW/25% Porsche if I had to speculate, but really it's a guess.  And the insurance mess will be very complicated, Misha said that UK insurance companies will likely go after the owner (BMW) for the money afterwards (will probably be well in excess of $100,000)."
bentley,,9,"I've seen a vid in yt about process of making switches and buttons for cars, it's a lengthy and  costly process. Dumping everything on the screen saves manufacturers thousands of dollars plus they can charge extra for different sizes."
rollsroyce,,4,"All of that is separate to the reality of people's complaints. It's not ""throw away all screens."" It's an annoyance how touchscreen are being used as an excuse to remove physical controls. It's about how screens are replacing physical gauges and often being slapped into the trendy wide-screen displays that combine a gauge cluster into the infotainment in a vertical screen that is an eyesore with no integration to the design of the car's interior.  Using a poorly center stack from 15 years ago, despite having a screen, does not fit your argument well at all. There was a screen, but the design was awful, so screens are clearly not an objective solution to interior designs that look good (especially well into the future). Using that image of an ugly interior with a screen to argue in favor of screens doesn't make sense."
bentley,,5,"I'll second this. The Range Rover is a very pleasant place to sit. But it's not a breathtaking place to sit. It's not as cocooning and isolating. It's not quite as thoughtful. It's luxury, but it's not ""I've made it and fuck the world"" luxury. The Bentayaga is.  Also, I think this is more Jaguar owners in one place than I've ever seen in /r/cars. Nice to know we're all pretentious douchecanoes, and it's not just me."
bentley,,10,I would love some good aircraft switches in my car. Love the tactile feel!
tesla,Model S,12,"Take it around the 'ring, see how much outperforming it does (not a lot)"
porsche,,9,"That’s the way American dealers handle things. They cheap out on everything to save a dime instead of helping their customers. They don’t even realize that is screwing them in the end game because it makes you feel like you don’t wanna come back and do service with them if they treat you poorly. On top of all that, the service advisor didn’t even know what the hell he was talking about.   SA’s are literally worthless and I never really take anything they say seriously because 90% of the time, if they’re an SA in a dealership, they just do it for the money. They don’t have a passion or knowledge for cars, they’re just the purgatory line to spew BS at you and try to make you happy lol. "
bentley,,7,"The passenger seatbelt warning in my Passat. I can put my backpack, groceries, books, tools, whatever manner of heavy items on the passenger seat and nothing happens, but put my phone there and the seatbelt warning chime immediately comes on (and scares the shit out of me because I think something has gone wrong.)  Also, annoyingly, if I have MAX AC set to on when I shut the car off, next time I start it, all the climate controls are reset with AC off."
bentley,,14,"The story I wrote cut down events a bit to make it interesting to read. I had it idling in the driveway for a good 5 minutes while I looked at everything and skimmed through the manual in the glove compartment. Also taking it out of driveway, at first it was just a burst to 60 mph. I didn’t truly take it pedal to the floor until I drove about 5-7 minutes more towards a highway, then when I hit the on-ramp I punched it there. I didn’t check the temps but it had been idling/driving for about 10-12 minutes at that point."
lucid,,16,"86’s are great, but there’s something about the tier of car the Supra plays in that puts it on another level for me. It’s a lot more expensive, a lot more work because it’s a lot more punishing, but it’s also a lot more capable, and therefore a lot more rewarding when I hit that perfect apex without spinning out. PB’s are a constant development as a driver and that’s what makes track driving fun to me. Tires are getting more expensive as I get faster though, and I think I’ve hit the point where time improvements are hindered by lack of downforce than lack of power or lack of driving ability."
ferrari,,16,Someone saw one going into their factory and extrapolated. Presumably they're analyzing the sound and fake shifting. They don't need to wait for the 6N to do that.
tesla,,3,Sells 4X as many in Europe (50k vs 200k in 2024)
porsche,,5,"I love the concept of a corvette. They’re absolute performance monsters, but, and this is my personal opinion:  They’re too big. In a non widebody modern vette I feel like I’m taking up the whole road, like I’m on a train with rails. They’re wide and they’re heavy. I can’t  even imagine a z06 etc. I prefer my cars to be much smaller, so the cayman, M2, supra are the cars I’m dreaming of (currently driving a BRZ which is the perfect size for a sports car imo)  The c8 is of course the better car than (anything near it in price), but it’s not the car I would enjoy the most."
rollsroyce,,12,"Same here I'm fairly sneaky at recognizing certain moves and what people want to do and I'll block your ass without you even realizing I did it on purpose, without being an asshole.  I agree though, keep a steady pace without unnecessary braking.  I see so many people braking far too often when all they had to do is let off the gas.  You break, the person behind you brakes longer, and so on until some dude is parked 5 miles behind you. "
ferrari,,17,"and the acura beak, and the little bit on the lucid, don't think it looks good on any of those cars and think it looks equally dated here  that interior is a massive improvement though"
lucid,,4,"By that logic manufacturers are also over engineering ICE cars. New features are being added to ICE cars too, and this has been happening since the 1880s. In any case, it is not something to worry about too much since soon most car manufacturers will be making EVs and before long most cars on the road will likely be EVs.  Here is another point of view that might you see EVs in a different light:  According to BP, one of the largest oil companies in the world, earth has about 50 years worth of known fossil fuels at current usage levels. If we use it all up, we will have none left in case of a civilisational collapse that requires access to cheap and rugged energy that we might need to reboot civilisation. Keep in mind that that is for current usage levels, which are without doubt going to increase.  Also keep in mind that we have no marketable solution for alternative power sources in airplanes, and that we will probably still want military vehicles to run on liquid fuel that is independent of a grid. We really cannot afford to burn fossil fuels in cars if there is an alternative, which there is.  EVs will also lessen dependency on foreign oil imports, which in a world with mounting international tension, is a huge guarantor of safety and independence for countries who can generate their own electricity. Relying on fossil fuels is a matter of national security for most Western nations, although this is rarely discussed in favour of the environmental arguments."
