brand,model_hint,score,text
porsche,,71,"It’s utterly devastating. He’s had a great life, but he still had so much more to live. You can tell how excited he was to try and win the ARA title next year at the end of his recent documentary. Then you have the build videos with his daughter. His wife also recently got into rallying. From my understanding, they weren’t forced into it. They both genuinely wanted to do it and get to spend more time with their dad. While I was at STPR this year, I unfortunately did not get a chance to meet Ken as I ran out of time before the stages began. It’s unfortunate because now I’ll never get that chance. The guy is a huge inspiration. Most guys grow up wishing they could be a racecar driver but our financial circumstances usually take us on another career path. Ken didn’t let that stop him. He made his money elsewhere and then used that to live out his childhood dreams at an age when most people give up on them or retire comfortably when you have his wealth. I often feel he was underrated by the rallying community because of his viral popularity. He genuinely improved every year as a driver. He got to help start two major clothing and entertainment brands in the 21st century, own a lot of his dream cars, race in many historic races when most would kill to be part of just one of them, and he has a good family that I feel immensely sorry for. I don’t know her personally, but Lia seems like a good kid who stays out of trouble and knows the value of work. RIP Ken."
tesla,,7,"That '67 GT500 traps probably 10-15 mph faster in the 1/4 mile than a 2019 Civic Sport. It's not ""about as fast as"", it's considerably faster. Even if they have comparable 0-60 times it's because one is boiling the tires off while the other has little or no traction issues. Have them both go 60 mph then mash the throttle, it won't take long to see which one is faster.  My point is if all it takes is the swapping of a wear item such as an old bias ply tire to a modern run of the mill summer radial tire for the straight line standing start difference to disappear that doesn't make the car slow.  Now handling, that GT500 will likely get beat by that Civic in pretty much any race where it can't stretch its legs, like technical autocross. I would never argue against that but those old cars still don't handle as poorly as many on here believe."
lucid,,58,"I always think that kei/mini trucks are overly glorified by American car enthusiasts. I understand why y'all like them, they are the antithesis of big American pickup trucks, compact, utilitarian, and actually used for work; and of course, because they are forbidden fruits, never sold in America. I understand why you want them, maybe for a farm truck, driving around the property, or if you live in the city as a daily commuter car.   But trust me, as someone who actually drives Daihatsu Hijet and Suzuki Carry a lot for work, they are crap. People or businesses that own these pick-up trucks are ""forced"" to own them because they can only afford them or because it's not feasible financially to get better trucks. I think you already know that they are slow, barely keeping up with the traffic, and struggling when going uphill, especially with stuffs on the bed. They are uncomfortable, the seats are uncomfortable, and you can't adjust them. They are built for short people, you can't adjust the position of the pedals. The suspensions are uncomfortably hard. It barely has noise insulation, you can't hear the music or talk to your passenger when you drive. Driving them on the motorway is scary, they are short and tall with thin tyres, bad combination. It feels like a wind can flip your car, or if you make a turn or lane change, it will flip. Getting a Hilux is a huge upgrade for me.   I like small pickup trucks too. I think the Hilux is a gas-guzzler, too big, and too ""luxurious"". Man, I wish they made a smaller, body-on-frame pickup truck, maybe Ford Maverick-sized, but with a regular cab and body-on-frame."
porsche,,9,You don't have to guess. OP's last sentence explicitly says as much.
tesla,,12,Thought Conquest was a Chrysler thing (ba dum tss)
porsche,,5,"The guy was clearly talking about a plug in hybrid given the range comment, and PHEVs do tend to be pretty underpowered when in full EV mode"
tesla,,6,Only PHEVs. Hybrids (HEVs) aren't included.
ferrari,Roma,39,Seems like I’m alone thinking the front is an upgrade. The car lost some elegance in the back compared to the Roma though.   I see why they kept it mostly the same as the silhouette on the car is gorgeous.
porsche,,3,"Honestly, my 16 yr old son drives my old Lexus SUV & has been in 2 accidents in the school parking lot this year. Neither one was his fault, so the other insurance has paid for both. One was his friend being a smartass, swerved towards my son’s car & lost control of his own vehicle, took out the back door while it was open. That was the 2nd day of school. Thankfully nobody was hurt. We got the car back a month later. The other was a girl driving a truck & she didn’t look behind her before backing out & backed right into the driver side while he was exiting the parking lot. This was 2 weeks after he got the car back. It’s once again in the shop & he’s in a rental again. Both of my kids know I only carry liability on their cars because who the hell can afford full coverage on 3 cars? And they are both really protective of their vehicles. It didn’t make financial sense to sell either one of the old cars to get other used cars because there’s no way I could get anything close in comparison to what I have put into those cars. I went through a really rough patch at one point & almost had both of them repossessed because I was flat broke. Ended up literally hiding them both in my garage. So my kids know the struggle I went through just to be able to keep them & what a relief it was when I finally paid them both off. I think it’s because of the financial struggles that they are both so respectful of what they’ve been given. So yeah, the mustang stays. I was never handed a car, had to buy my first car on my own. But I don’t want my kids to start out their lives struggling like I did."
tesla,,21,They would be adding miles not resetting to zero if that’s the goal
tesla,Model S,4,"You get the exact same stigma attached to the Nissan GT-R. Because I can drive it 1,000 miles with luggage and without destroying my body I have been able to take it to some of Europe's best tracks. If it was a brutal track day monster it would have stayed at home, only ever driven at the local track and In summer I would have taken a plane to an all inclusive resort and sat by the beach instead."
tesla,Model S,9,You don't need to flair the g35 we already know
ferrari,,883,"find a different dealer, I'd also call that guys sales manager. Personally. btw, as a 33 year old who looks 22, I can tell you I've had better luck trying to test drive sportier cars by calling ahead. A couple years ago I was denied a test drive in a Cayman when the 981s came out, he said they didnt have any for drive (which I knew was bogus), called the same dealer as soon as I left, said I was interested in test driving Caymans, came back after about an hour and drove one. The sales guy was probably pretty peeved seeing me with another sales guy the same day, but it was his loss. "
lucid,,6,As an EV driver of 8 years I would never want a hydrogen powered car.   People tend to complain about charging times of EVs.  But I save far more time being able to fuel at home then I lose charging when I am driving long distance.   So for me an EV is much more practical then a car I can't fuel at home.    Plus there have been many takedowns of this.  Hydrogen doesn't avoid the chip problem as they will still need chips to build them.  And fuel cell cars also have batteries although smaller then a BEV.     Plus at the current time hydrogen is very expensive.   And then finally the efficiency of creating hydrogen is pretty terrible.   So you are much better off to charge a battery pack directly with the electricity.  In the end I don't think hydrogen will be a fuel used for small vehciles.    It might see more use in larger ones though.
tesla,Model S,74,Remember when windows held a funeral for the iPhone?  Lol
ferrari,,37,"Gearing plays a part too. I had a 3.7 V6 Mustang, 300hp. On stock 3.15 gears it was slow af. Swapped out to 3.55s and it was much better. But tbh, it really needed 3.73 or 4.10. Ford put the 3.15 in it for fuel economy.   A lot of modern cars are geared way too long for fuel economy reasons. The IS500 should have much shorter gears. But Lexus geared it long for fuel economy and it kind of neuters the V8 a bit."
tesla,,161,">develop brain chips  The less is said about Neuralink, the better.  Everything they've actually shown is pretty standard neuroscience stuff fluffed up by marketing. They have no revolutionary technology. Musk built up their september showcase to be this incredible thing, by saying ""we're gonna see neurons fire live"" (That was first done in the 70s, so its about as old as he is), and the pig demonstration was just playing sounds in response to sensory stimulation of the snout, which was done about 20 years ago, give or take.  Proper universities are way ahead of anything Neuralink has demonstrated, and they have the added benefit of being held to higher standards, regarding what they claim and demonstrate.   Spiking data from in vivo neurons is old news; that's been possible for years. The hard part is processing that data in a useful way, and solving problems with it, something that Neuralink doesn't appear to do.  The only unique thing about Neuralink is that they have a garillionare funding them, and presumably they won't have to deal with funding issues like a university research group will. The downside of having a garillionare funding you, is said garillionare will then go on to say stupid irresponsible shit like ""it's a fitbit for your brain"", which no it fucking isn't, and to suggest that indicates a fundamental misunderstanding of the technology at best."
porsche,,6,"Not really - the company they were using for their prototype prismatic cells went bankrupt, which added delays - and they still haven’t been able to hit internal targets for range/weight with different cells from CATL which caused the second big delay.   While demand is in the gutter now because of their decimation in the Chinese market, probably not a lot of weight behind getting it out the door."
tesla,Model S,26,Don't stop there. Charge it up again and find those last three seconds!
bentley,,8,"You say that so confidently, but what do you think a plaid is doing when you engage cheetah mode? Or when you engage launch control in any street car?   Why are the goal posts being moved now? I said you can hit 60 in under two seconds, and now you’re telling me there can’t be traction control and it needs to be on a tire that lasts 20000 miles like a ps4s? When every high performance exotic in the last twenty years ships with pirellis/eagles/cups that last 2k miles?   Bro I don’t know what to tell you. I’m using rwd as the argument that it can be done, and I’ve given multiple examples.   Now add awd. Add electric motor torque response. Add well-designed traction control. Add air suspension that can preload for launch.   Why are we pretending like I didn’t just show you multiple cars that accelerate way over 1g?   Fine. Take an old DSM, Gut the interior, make 600 hp, and add four Cup 2s. You’re going to hit 60 before two seconds. That’s an 8-9 second car, and a 10 second car on the worst road you’ve ever seen. I don’t get what the argument is here."
rollsroyce,,6,"I’ve had a M3P for 5 months now, have no issues and had no issues with body work or anything else at this point. 7k miles on the car.   I agree with a lot of the statements both positive and negative, but where I live in the Midwest a lot of the charging issues don’t exist for me here. I have a charger at home now, but before I did I never saw a SC more than half full.   I actually find the 2022 M3P a bit soft and spongy compared to the competitors as far as ride and suspension. The turning is very quick and tight though - maybe the difference between a sedan and a crossover."
tesla,,28,"> All brands should do this and cut out dealerships…  Not all car makers should be forced to sell through the dealership model, agreed.  But what I wouldn't want to happen is having all car makers forced to sell without the potential for middle-man involved.  BMW/Audi/Porsche/insert-favorite-car-maker-here should be legally capable of opening a flagship ""dealership"" that also includes a killer track that people can test drive on.  There shouldn't be any reason, from any state, that would prevent the maker from building the space, and paying for it.  At the same time, those same makers should also avoid wanting to get into the costs of land, building, maintenance, etc.  Remember: dealerships aren't dealing with just selling cars, they are paying local taxes, wages, maintenance, etc.  Some car makers simply may not want to get involved with that, and that's fine."
ferrari,,135,"I have a friend who has an impressive lack of knowledge about cars. Its going to sound like I'm making all this up because its almost cartoonish, but I'm not.  * He genuinely thought that cars had a certain amount of V's. Aka a V8 has 8 V's, a v6 has 6 V's * He has ridden in my loud, supercharged, white corvette plenty of times. I once had a rental 3 series in white which he rode in the back of. I asked him what he thinks of the 3 series, and that is when he realized it wasnt my Corvette * He thinks my 1995 Suzuki Sidekick is a jeep. He thinks I'm messing with him when I tell him it isnt a jeep. I finally convinced him by making him google it * My wife traded a 150k mile beat-to-death, gray dodge caliber for a black 2017 GTI. He couldnt tell the difference, and he thought the VW logo was the Mazda logo. * He thought my atom was ""One of the slowest"" because he only knows it from Forza. Apparently its the starter car, so ""logic"" led him to believing its hard to drive, and its the starter car, so everything after that is an upgrade.  I think hes about average for people who arent interested in cars, honestly."
lucid,,5,"As someone else already said, the wealthy are the best first adopters.  Perception is very important when marketing a new product. When car manufacturers first tried to offers small, economy EVs in the 1970s in response to the Oil Crisis, the public saw them being actively purchased by broke granola hippies and ""stick-it-to-the-man"" counterculture folks, therefore the association was negative.  Now, car manufacturers develop and market EVs as luxury vehicles, so the public perception has changed accordingly to see EVs as something wealthy and successful people buy and associate them as something cool, futuristic, and aspirational."
porsche,,173,"While not as severe as your instance, I lived in a house for 8 years where there were regular vehicle accidents, for similar reasons to yours and then some! Being near the end of a straight away, there were two fatal motorcycle wrecks as the result of trying to take the curve at over a hundred. I knew the person who died in both instances - not well, but still. Even if you are wearing a helmet, a tree does not care at that speed.  In the other direction, people will lose control and come reeeeal close to taking out my mailbox. One time, a lady passed out at the wheel, went off the road, taking out my mailbox, hitting the ditch as if were a ramp, travelling through my neighbors yard and coming to a stop in a bush. Ended up climbing through the window of her car myself and eventually pulled her out of the car so we could start chest compressions. That's a fun story to tell!  Edit: My favorite one is actually documented. Sitting at home one night in October and hear a loud bang and crash. Walk outside to what can only be described as a warzone. [PICS](https://imgur.com/a/du29U8P) [VIDEO](https://streamable.com/egwaaq)"
lucid,,34,"They’re probably marginally more reliable than the rest of the field, but not like they were 30 years ago.   Reliability is just a crutch Toyota fans lean on to explain why they’re paying out the ass for cars that haven’t been updated in 15 years and why they won’t buy anything from any other manufacturer no matter how much better a value it is.   No, bro, you don’t need to pay $60k for a 4Runner with an appearance package because you’re worried about being stranded 1000 miles from civilization in a Wrangler."
rollsroyce,,3,"Thanks for the heads-up on checking the manual to find extra USB ports. I figured that if they were there they'd be easy to find and access, since everything else that I want sure seems to be, but I'll take a look at that this afternoon."
rollsroyce,,34,"Some people just give so little shits about how strangers perceive them that they're willing to downplay their image in exchange for some fun  Same people who would wear rag-tag clothing to a high-end car dealership so they get to talk to the new/humble salesman and play a joke on the vain salesmen that brush them off. *They* know they can afford the car, but they don't care if others know they can afford the car. "
tesla,,3,"Whole idea between Western and Asian is very different. It isn't just about their car industries, it's about almost everything, honestly."
tesla,,26,"Mostly because the extra power to throw around comes as a result of having more battery, and the motors themselves are relatively cheap to manufacture so may as well tie them into the trim levels so that added power can be made use of. It'd be like putting a block behind the accelerator pedal - reducing power for little to no reason.  The slowest version of the 3 with the 75kWh pack is the now-discontinued RWD LR, and that still throws down a ~4.9s 0-60."
ferrari,,3,"Exactly.  The richest person I know (probably 200-500M net worth) is incredibly nice, polite, and has spent large chunks of his fortune to help children's organizations, and stuff like that.  He reminds me of Bill Gates, in that it seems like he realizes the best thing he can do is use the money, beyond what he can spend on his own comfort, to help others while he is still around to do it (and set up foundations to do it when he is gone)."
tesla,Tesla,3,"Haha I mean we’ve been running 9s at 150+ mph in the quarter mile with 6,000+ lb 4wd duramaxs since 2008. Not saying it’s safe but as long as you don’t try and comer like it’s an f1 car you’ll be alright. Good for towing a ton of weight with more efficiency than stock and beating on super cars in a straight line for fun! Plus it’s Tesla, they have the highest safety ratings out of any car from my understanding. I’d imagine somewhere the computers won’t allow certain things to happen at high speeds. Just my $0.02"
lucid,,16,"Yeah and the issue is people, for whatever reason, naively believe time and time again that these companies wont take advantage of the position that they built. They will, thats the entire point.   Recent example of this is the whole ai editor thing, all of them on a vc-subsidized race to the bottom, people are going to be disappointed when they start to realize how much the real cost is, its already started to happen."
tesla,Tesla,58,"Most of Tesla design reeks of solutions looking for problems.   Electronically controlled glove box latch. Crazy door handles that get frozen shut in ice. Falcon wing doors that take extra time to open and close. Glass roofs more prone to break. No climate control buttons or knobs.   If it ain't broke, don't fix it. But that's Tesla's problem - they want everything to look cool and futuristic, functionality be damned, because that's their brand and sales proposition."
rollsroyce,,8,"Yup, I agree.  After thinking about it some more since I posted that I think the beginning of the end (or at least start of the transition) was the growth and emergence of Google.    Google made it so there was no longer any of that ""searching"" for the particularly quality content, no more ""word of mouth"" spreading of quality pages online, it was like a natural reddit upvote but for the whole early web.  Once google came around you would just type a word for what you wanted and it would take you there, but 99% of people are not going beyond the top link... and knowing exactly how google adsense works, you'd know being that top link is very easy with a little money.  Even google making billions doing this didnt realize the power they were simply handing away, even for BILLIONS of dollars it was pennies on the dollar value for literally every human interested in a particular idea or concept being forwarded to your page, your sponsored content.  Again, the fact that this is happening to everyone using the web, times the *hundreds of millions of users* makes for a lack of scope and perspective, its hard for a single individual to see this from their own first person POV, its so vast."
tesla,Model S,2,"Hybrid CRV and RAV4 if I had to guess.  People want electric but decide on hybrid in the US because of the depreciation and convenience issues for many people. I bet rental volumes are down too, I think that’s the biggest market for Rogues usually and if they’re tightening up due to economic uncertainty…  Just checked and CRV crushed it (best sales month in history at 46k units) and 54% of its sales were hybrid (all time high)."
tesla,,93,"Completely agree with your points. Here in Aus I do see a number of BYD reviews that are a bit ""too good to be true"", so it's better to rely on word-of-mouth, and so far it seems BYDs are good, but not exceptional cars, and there's nothing wrong with that.   On the other hand, some reviewers seem to have a slight negative ""tint"" to BYD? Like, Top Gear's review of the Dolphin Surf has the headline: ""Nothing we say will stop this car selling like crazy"" which (IMO) is a tiny bit aggressive, and the reviewer doesn't really hide how much he hates the car, although the other big UK outlets are notably more positive towards this car.  I do wonder if BYD has threatened legal action to any of the big reviewers, considering some (like Top Gear) seemingly detest BYD and every car they make."
rollsroyce,,5,The Z06 sounding tame is the craziest thing I’ve heard in a while and the world is incredibly crazy right now.
rollsroyce,,21,"Another thing to consider is a pedal lock, I used one in high school on my civic, i would put it around the clutch pedal. You pull it super tight to the pedal. Car was broken into twice and they couldn’t get it off. Obviously there’s ways around it but could be worth looking at. [Amazon link](https://www.amazon.com/CL606-Brake-Vehicle-Anti-Theft-Device/dp/B000L9T7AY/ref=mp_s_a_1_3?crid=2CGH79ZP93D3S&keywords=clutch+lock&qid=1658503651&sprefix=clutch+lock%2Caps%2C143&sr=8-3)"
rollsroyce,,10,"Yeah there’s a much bigger problem going on with car shipping and this is one of the latest examples. Central Dispatch had been inundated with transport scammers and a bunch of people are experiencing this. From the sound of it, there’s been changes made to help combat this but it’s still a big problem."
lucid,,5,"> Nestled into the southern slopes of the Alps, St. Moritz sits at roughly 6000 feet above sea level. Munich, on the other hand, is located at approximately 1700 feet above sea level, or 4300 feet below St. Moritz. In 2021, we made a similar descent (closer to 6000 feet) from the summit of Pikes Peak to downtown Colorado Springs in a Porsche Taycan to prove just how much gravity helps regenerative braking. Spoiler: it's a big help."
rollsroyce,,22,"The oldest trap in the book, its comical how easily that car can generate some serious repair bills even if you work on it yourself. ABS brake modules are over a grand, the SMG transmission will do anything to un-alive itself, vanos problems galore, and if the previous owner neglected it, its basically ruined forever.  If you take a look at one and its leaking any kind of fluid, run as fast as you can because even 20 grand set aside is not enough. I know someone who had an E60 M5 that was basically a Ship of Theseus in car form, only the engine block and some interior parts remained. The car literally hates you for keeping it among the living lol."
ferrari,,9,"I've lifted both those rear clams.  I have trouble believing that it's a 100 pound difference, but it's very noticeable.  I don't mind lifting the clam on the euro car but I definitely have to think twice before doing it on the US one, and not just because it's broomstick is more cantankerous.   More noticeable -- as you know -- is how much extra bracing there is in the front clam.   The US car can be carefully opened by one person.  The euro version is flexible enough that it always requires two people.   Also, you have to do a side by side comparison to tell, but the euro doors are lighter as well. "
