brand,model_hint,score,text
rollsroyce,,7,"I was blowing the tires off in third as well. I'd feel the car pull timing and boost when it hit peak power at 5000 or whatever, and I'd see the traction light flash. Shitty tires probably made the transition between 2nd in your case and third in mine.   However, either way:  Completely unacceptable when a Mustang 5.0, with more power!, puts it all down on corner exit (so, still turning) in fucking second gear. Porsche GTS puts it all down in FIRST gear with only marginally less power, on bald tires in somewhat cold conditions."
tesla,Model S,3,"At this point you're kinda relying on old data.  One thing you need to realize is that many companies are dropping billions of dollars into improving EVs, and they are still a nascent industry, so they are getting better all the time.  Therefore, most of what you said is being invalidated as we speak.  The new Model S does have better charging times.  It is 200 miles in 15 minutes now.  Obviously still not as good but it is improving, although I don't think it'll ever hit the speed of filling with gasoline.  That said, for day to day use, it is much faster to just plug it in at home or work compared to stopping by a gas station.    They also spoke of 30-40% improvements in cold weather due to new designs in their heat pump and such.  Range degradation in cold weather should be much less in these new vehicles."
tesla,Model S,82,"I love love love that there's competition between the two. Proud of Tesla for being able to challenge Porsche in this regard, but kudos to Porsche for taking EVs seriously."
rollsroyce,,7,No wonder this rebadged Alphard taken many original LS buyers and now make LS not available there anymore.
ferrari,,28,"Looking into this, they don't share much history about this specific car itself, which I find suspect for the asking price.  And I'm not about to drop $50 for a detailed VIN lookup"
lucid,,13,"I think that's coming, and people are jumping the gun a bit in writing off EV's entirely. No, they will never be 1:1 for gas powered cars and the sound of an engine. But give automakers some time to start rolling out more enthusiast focused electric cars, and I think you'll have more options that appeal to the crowd that needs more engagement. There's no reason you can't make a manual electric car for example, purely for driver engagement because there's no other reason to do that, which I think Lexus is working on already."
rollsroyce,,10,"I will say old muscle cars do hit different. One of my more memorable rides was in a friends El Camino with a Blown 427 and 24"" wide drag tires on it. The way they throw you back in the seat is just so visceral."
bentley,,3,"Congrats, man! Enjoy the car. Clearly it sounds like you love it, so keep on doing what you're doing.  >The other alternative is just keeping this one and buying mods once the warranty expires. I'm already pretty much set on buying the OEM carbon roof and Fuchs light wheels (https://imgur.com/a/RjwRQwt  Is the car a convertible or targa top? How do you change the roof on that without literally cutting the roof out of the car? That'd be expensive as all hell."
tesla,Tesla,71,"The dealers are a convenient buffer between the manufacturer and the customer.  Notice how people bitch and moan all the time(most of the time justifiably) about Tesla service, and especially whenever they change their prices?  When the MSRP is mostly academic and it's the dealers fiddling with the price structure and trying to upsell you, you can hate the dealer and still love the brand.  But honestly, a lot of the kind of shenanigans that dealers get up to are done with the tacit blessing of the manufacturer.  The dealership model just gives them plausible deniability.    At least Tesla owns their role in the entire process, however good or bad their performance in the whole delivery and post-purchace interactions are."
porsche,,12,I think we used to have some semblance of a weight class. Supercars fought in the $600k devision. Hypercars in the $1m division. Exotics in the $300k division. Etc. Companies scaling the cars to $6m or whatever it's just... who cares? Of course you can make the car faster if you spend infinite money on it. NASA can pass a million horsepower for some hundreds of millions. Who gives a fuck if there are no boundaries?  The $60k (because of the C8) to $200k range has become a lot more interesting since we're in the prime era of lower cost mid engines.
tesla,Model S,-1,"I made a comment replying to you and agreeing there are significant concerns with buying Chinese products and that I have stopped buying them even though they make good products, and my comment was removed by a moderator. I'm not sure what part of my post was against the rules, but I feel like it's worth saying that this happened and that my seemingly pro-China posts are left alone while my post about privacy concerns and patent theft was removed."
tesla,Tesla,25,"It's a situation I can say that's variable. I'm in a group of furry EV owners, and our tesla contingent has pretty mixed experiences, weighting worse depending on what the newest model is. Most Model 3s coming out now are built well. Model Ys are.... It's a bit of a gamble. Model Ss and Xs are built well, which is why you don't see /r/cars bitching anymore. There's nothing really to pile on with on the really nice ones"
ferrari,,8,"A friend of the family had a Talon. She bought it new or lightly used back in the 90s, and took it out for a spin on 'desert'ed (heh) Arizona roads. Hit 140+ and got zapped at over 100. Told the officer it had just gotten work done and she was making sure it was ok. Got a warning! Always loved the look a lot more than the Mitsubishi versions. Hope you can keep it out of the shop, drive safe!  Tl;Dr: totally a supercar!"
tesla,Tesla,22,"Because the SEC is neutered, and more worthless than ever and the way the dogecoin tweet is phrased protects Elon enough that its a waste of time if Elon wants to fight a lawsuit, which he will.  The secured funding at $420 post shouldve been jail time, for securities fraud. Despite the meme number, people took it seriously, and Elon uses his twitter as an official megaphone for Tesla. That was a clear cut case and they only slapped him on the wrist because he was going to fight it."
ferrari,,5,"Context matters. When you’re talking about exotics, $100k isn’t much."
bentley,,75,Can't tell if it's because the rest of the VAG group are doing too poorly or if the ultra lux SUVs are THAT profitable
tesla,Tesla,19,">That being said, people do dumb shit in cars all the time, this one just happened to be in a Tesla. For example, how many idiots kill people street racing? Should manufacturers and aftermarket companies be held liable? Tesla knows this is a slippery slope.  Why is this a poor argument?   1. Because it doesn't address the original point:   >but from a safety point of view, Tesla has done the absolute barest minimum job of detecting driver engagement. Everyone else has adopted cameras for this task, while tesla continues to rely on torque sensing that is easily duped.   Tesla has a flawed way of monitoring driver attention when the car is driving itself. Other companies like GM and Ford have since found a better way of monitoring driver attentiveness and warning the driver to re-take control of their vehicle. The government is behind on self-driving regulations for automotive safety and as a result, we have companies like Tesla that cut costs at the expense of driver safety by not implementing the better driver monitoring and alert system.  2. No one made the argument that street racing a vehicle makes the manufacturer liable, but I think everyone could agree that there should be regulations on the liability of the manufacturer when it comes to self-driving systems. The government has plenty of regulations on how software and hardware in a vehicle is supposed to function in regards to customer safety. Self-driving systems are no different, they can and should be regulated to some degree.  >Should manufacturers and aftermarket companies be held liable?  Sometimes, yes."
bentley,,4,"Holy hell. I know they offer manuals and automatics. What they offer from the factory does not change what people have bought from them already in the past and are now selling on the used market. It's great they offer a clip or focus or some shit in an auto, doesnt mean there are necessarily more autos on the used market of all people buy are manuals.   My comment was referencing that perhaps the person was looking at the used car market, meaning g they obviously wouldnt have a choice in their transmission and perhaps the overall amount of automatic options would be less apart from some higher end makes which only offer their vehicles on auto (or their owners are more likely to spec it). "
porsche,911,13,"I'd imagine the pricing for this is similar to the previous ones they made in the last 2 years, like what I have for my 996 -- in which case, the actual navigation functionality is an extra $200 or so, and no one really ends up buying it because Google/Apple maps is far better anyways.   But I agree -- it's honestly not a bad deal, especially for a 911 or Cayman where a 2-din stereo doesn't fit without a $170 trim piece anyways. Depending on what you get, I'd say that a third-party stereo from Best Buy or something with equivalent features would be $7-900. So plus the trim piece, about $1k. Assuming installation is the same, it's not really a huge difference for most people when you get the added benefit of pretty good build quality, a better (IMO) look, and it being ""OEM."""
ferrari,,17,The CT5V Blackwing and C7 ZR1 are all fantastic with 650+ horsepower and a manual.  Just have to get the right manual.
lucid,Lucid,10,"Lucid is heavily backed by Saudi investors, so if tensions ever rise between the U.S. and Saudi Arabia, things could quickly get political. Hoping nothing like happens though but still a risk if one is buying their car to avoid politics."
ferrari,,3,">It would be even easier to do this with the Golf R. The 7.5 R looked almost exactly like the normal Golf.  The 19"" wheels, front bumper and quad exhaust are easy tells if you're somewhat observant, but to a rando who knows nothing about cars sure they look basically the same. Would be really easy to badge delete, there's just one R on each side of the car and that's legit it lol. The base Golf has more badging than the R."
tesla,,43,"It's probably cheaper, we're talking almost pennies at scale.  And you'd be surprised how much OEMs are willing to sacrifice the UX to save a few pennies.  I got into heated debates about this when I worked at GM as an intern in infotainment.  But if you find a way to save a few pennies, you get a nice bonus, so most of the engineer's goals was more motivated by that perverse incentive, rather than making a GM product enjoyable for the future owner.   And if you're not creative or knowledgable to genuinely improve a process, you just make an argument to move another physical button into the infotainment. Every new-ish engineer did this."
tesla,Model S,19,"The best selling car in 1951 was a Studebaker. In 1966, the last Studebaker rolled off the line and they shut it down"
ferrari,Ferrari,19,There’s plenty of nouveau rich who buy Ferraris for the prestige too without really caring about the mechanical aspects of the car too
porsche,,3,"The Mach-E is a good car, it drives pretty well despite the weight and it looks nice. But it was made as an experiment for Ford to figure out how an EV should be made, not really as a car to sell long term.   It falls short versus a Model Y in every objective measure, which is why the sales are what they are, but Ford will be unveiling their actual competitive EV on August 11th, which will give a better idea of where they are."
lucid,,14,"Savage Geese doesn't feed the algorithm as much as other channels. You know, clickbait titles, perfectly crafted thumbnails with a wide arms pose in front of the car (apparently that works), ""like/comment/subscribe!"" - you get the idea.  I like SG, but I find their perspective a bit limiting sometimes. They seem to have that cynical, specific-kind-of-car-enthusiast thing going on and a bias against a carmaker or two. They do admit that bias at least, so I think the lack of reviews of some cars is more of an integrity thing which is OK in my book. The issue is me having different tastes (more general) not the channel being low quality at all.  It's clear YouTube's search has very different taste in videos from me too, unfortunately."
porsche,,558,">  I remember the best part of the work week at my first job at Chrysler being the new ""Dear Doug"" column getting published on Jalopnik Friday afternoon.   This is so wonderful to hear :) I remember those columns too, I loved doing them, and I'm always so glad to hear from other people who enjoyed that work.  > And if Doug somehow reads this - will your wife ever be allowed to drive the CGT?  She doesn't drive manual!   I have actually been very, very generous about letting other people drive my cars for a long time, but I think that stops with Carrera GT. The clutch is both very expensive and very tricky from a start, and frankly I don't really want to put the responsibility of a seven-figure exotic car on someone else's shoulders. My friends all understand and agree."
tesla,,11,"I brought my old GS300 I bought used with 250,000km in for a service and checkover as a 19 year old into a Lexus dealer.   I was given a lovely bottle of wine, some local chocolates, offered an RC350 for the day and they even washed, waxed, and hand polished my car all (I got to watch the detailers wash it). The receptionists also made me a coffee and brought over a small cake to have with it. All for about $250, for someone my age it would be more expensive to hire an RC350 for the day anyway.  They even took me through the dealership and let me get up close and personal with their LFA and have a sit in and chat about the LC500 and pristine LS430 they had on the floor.  I fucking love Lexus dealers."
rollsroyce,,14,you cant get a true sound of the car through computer speakers.  but yes the new laws against sounds are here.  i was passing by a nice neighborhood in the city last week and on the main road they had a sign that said 'no downshifting' lmao  just buy an exhaust if you want a louder car
bentley,,45,"In addition to cost, also space. A transverse mounted engine lets you shorten the chassis and expand the cabin.  The reason why all those other cars you mentioned do it is because they're designed to be big, and thus don't have the same space limitation."
ferrari,,3,"It was a small team, they knew they could chase the big dogs around an entire lap or win their class, so they decided to go out with a bang and grab attention differently"
bentley,,3,"Was hoping that the BRZ tS would be more significantly faster than the old one with the upgraded brakes/suspension. Sounds like the brakes made the difference so that the car is track-able out of the box, but the handling hasn't improved at all."
tesla,Model S,45,"Tesla's going for the jugular with this lol, model s plaid competitors like taycan, e-tron GT, the bmw models are all in danger lol. The other companies need to either up their game and get better performance or differntiate themselves from a Tesla (imo taycan is most likely to do this), not a tesla fan, but they are doing well with this"
tesla,,5,"If you look at Porsche's other models there's a huge gap between the pricing of the top spec model and the base model. For example the Panamera, here in the UK, starts at £72k. A bit of playing around with the options and it's possible to spend over £200k on one (£149k+options).  The Panamera is probably the closest thing to the Taycan in the current Porsche range, so I'd not be at all surprised if the base model when it's out is around that £80-90k mark."
lucid,,4,">Modern ICE cars just don't have that much character, outside of a few very high-dollar examples. What character is there is often purposefully engineered in, too. For instance, the LT1 in a C7 runs way rougher than the LS1 in a C5, which is really weird when you stop and think about how much more advanced it is. LS1 cars won't pop and burble like a C7 either, how strange, they just run smoothly like an EFI car ought to...  Define ""character"""
lucid,,92,Some of this is definitely nonsense.... But $1500 for a windshield with 3 chips in it seems reasonable 
rollsroyce,,4,I hated it.  You were always trying to avoid eye contact with the drivers behind you.  Stop lights had them staring right at you.
lucid,,4,I owned the 350z for many years and loved it so I am probably a good demographic. It starts at 40k whereas the 350 and 370 started at right around $30k. Additionally you need to kick in another 10k to get the (iirc) LSD and bigger brakes which is pretty steep IMO. Finally when I looked around the only colors anywhere near me in manual were gray. I've seen maybe 2 on the road so far. I'd probably comparison shop the Supra.    Edit: Forgot to mention the markups are so high you might as well look at a Porsche Cayman
tesla,Model S,19,"The author is so stupid that he can't even disguise the fact that he is really just writing a hit piece against Musk and not really about the Model S.  >  Up on Angeles Crest, the Plaid is incredibly quick,   This shithead is driving ""incredibly"" quick on the Angeles Crest Hwy.  Enough said about his stupidity.  The model S stops from 60mph to zero in a very short 105-110 feet.  Those are pretty good brakes.  Take any regular car and drive it on the track with some hard braking, and the brakes will fall apart very quickly.  The brakes on the S are more than enough for street driving, even when you do short burst of full power acceleration.  And if you want tracking capability, you get the upgraded brakes in the track package, just like any street car would need to."
tesla,Tesla,54,"Who knew an industry that took huge corporations decades to refine their production lines at every angle is difficult to break into. The Japanese car manufacturers and their achievements in mass production and QC should never be underestimated, something it seem many Tesla investors/fanboys seem to deliberately ignore. These companies survive in an extremely competitive industry because they are good at what they do - or they get bailed out by the US government.  Building luxury cars at expensive prices in small volumes are far easier than creating a production line that can build thousands and thousands of cars at an affordable prices, at a quality that won't fall apart after 30,000 miles. It is a completely different beast. Entire careers of the smartest people in the world are spent perfecting these production lines, improving quality by 0.1 % there and reducing cost by a couple of dollars here. The sneers and jeers by these Tesla fanboys are really grating in this context. Absolutely no respect."
rollsroyce,,3,You should have a look into your local scca pca and bmw auto x clubs. I joined all of them as a complete noob in a Miata. Once I could show I would be helpful to other new comers people would just toss me there keys to show them what they car was capable on an auto x track.   I was even asked to help do “pro drives” at those super car events because of auto x. Getting paid to drive Lamborghinis and Ferraris is not a bad day :)  I bet you could easily have the same experience!
bentley,,3,"You don't even have to be that rich to live on the water.  But it should be noted that just because you live on the water or even have a dock that you'll keep your boat there. For instance I use to have a dock but I kept my boat at a marina a few miles away. The boat was a 36' searay (I think, it's been several years since I had it) and the river I lived on wasn't deep enough during low tide for the boat to pass (especially with all the debris that is on the bottom of that river).  So there's lots of reasons you'd keep your boat in a marina rather than docked at your house. Plus it's just kind of easier to get maintenance done on your boat if its at a marina."
tesla,,6,"Waymo is definitely not L4, its like 3.5. It will absolutely fail in situations like busy parking lots, and there are plenty of videos on youtube.  Also Waymo has a bad future ahead of it, with its CEO jumping ship, and their business plan to... retrofit chrysler vehicles... Meanwhile Intels mobileye has secured 13/15 of the top manufactures and a ton of the startups like NIO. Considering they are only going to start autonomous taxi's next year, they are probably a bit behind in tech, but they have the support and profitability Waymo lacks. Also Google has a bad track record of supporting products. I wouldnt be surprised if they scraped any take on consumer cars and tried to push for trucking or a military contract."
tesla,Model S,2,"Oh god I still have PTSD stuck under Gardiner for literally hours last year. Didn't realize there was Blue Jays game, otherwise I would absolutely choose another route. As a car enthusiast, moving out of urban Toronto is the best decision of  my life."
lucid,,195,"He got $500k cash plus $5.5m in options then another huge dump of stock. January 2022 stock was $40/share, now it’s down 90% to $5.    His stock might have been valued at $350m, but unless he sold it all that might only be $5m now. Giving the ceo of a fledgling company a large amount of stock (they have 2.2 billion shares) as compensation is not unusual - it ties their comp to company performance and the company can’t afford cash compensation at the level he might demand."
bentley,,131,"[The Audi A5 (2007)](https://upload.wikimedia.org/wikipedia/commons/thumb/4/4f/Audi_A5_Coup%C3%A9_S_line_2.0_TDI_Teakbraun.JPG/1200px-Audi_A5_Coup%C3%A9_S_line_2.0_TDI_Teakbraun.JPG). In my personal opinion it looks a lot better and a lot newer even than the [current one](https://hips.hearstapps.com/amv-prod-cad-assets.s3.amazonaws.com/images/16q2/667349/2018-audi-a5-first-drive-review-car-and-driver-photo-668894-s-original.jpg?crop=1xw:1xh;center,center&resize=900:*), the current one looks like some arrogant nerd wearing braces."
tesla,,13,"That's great! As with all things, statistics can be weird. You may have had an incredible experience where other people have cars with center consoles that rattle in place. Both of those things can be true. An excellent example is my last car: 2021 VW GTI. Ask any GTI enthusiast, and they say resoundingly that the mk7/mk7.5 GTI is the best VW ever made, top tier quality, etc., and I had nothing but problems with that car. Interior rattles, interior panels that would shake, the ""soundaktor"" speaker literally blew itself out, etc."
tesla,,6,>I don't know what's more crazy. The fact that even on an unprepped surface this full size family sedan can go 0-60 faster than literally every automobile on the planet that isn't some multimillion dollar hypercar.  This is why I like electrical motors more than ICE and diesel engines. Doesn't matter the application. Electrical motors are more efficient while weighing less. Instant-full torque at 1 RPM is superior to waiting for engine RPM to catch up to max torque.
tesla,Model S,157,"I will get another EV but you can bet my life, it will not be a Tesla. Voting with my dollars doesn’t have an immediate effect, but it’s just as important overtime."
bentley,,6,"I have been feeling this way all day today. All of these cars are starting to look like the concept cars designed in those car design trade schools. If you don't have a strong brand like Honda, BMW, Mercedes, or Alfa then the cars seem like they were picked out a catalog.   Look at the Polestar 4, Lotus SUV, and the new Buick crossover. They all look ""cool"" and ""unique"" but not adherent to any brand and thus who cares?"
lucid,,10,They are quite popular in nyc/sf/seattle/toronto/etc. any tech hub
porsche,,7,"yeah, there's definite some good dealers out there. I negotiated my i3's deal over the internet and agreed upon a value. When I got to the dealer, the numbers were different. Everything was the same except the monthly was lower!   Same with my cousin who just leased a loaner e300. Originally was supposed to be $350/m @$3500 OTD (10 MSD's). Drove two hours to the dealer and to his surprise it was now $300/m with the same OTD.    When my uncle bought his accord though, that was a completely different story. I get angry driving past that Honda dealer every time not LOL."
ferrari,,7,Lucky. They won't insure my E30 for stated-value cause I want to drive it as a seasonal car next to my M2 for purposes other than car shows.
porsche,,3,"Exactly. It's brought up because it absolutely is a valid consideration.   Generally the people bothered by it being mentioned seem to be the ones who haven't considered it, or aren't comfortable with it.   Yes, a $5k macbook will depreciate faster. But it's a 5k investment.   A 50k vehicle may not depreciate as fast %-wise, but within 3 years you're probably able to buy 4 5k macbooks with the depreciation alone - so you absolutely should be considering the loss of value and whether it's something you're happy to live with.  Unaffordable or unpalatable depreciation is why people buy corvettes and only drive them to church on a Sunday - if you're worried about driving a vehicle because of the depreciation, it absolutely needs to be considered as a factor in the purchase, and hiding behind ""being an enthusiast"" or ""other people not letting us enjoy our interest by mentioning depreciation"" wreaks of insecurity about the decision."
