brand,model_hint,score,text
ferrari,,3,"Also the E92 M3 (V8 S65)does hold price better than the E60 M5 (V10 S85).  The M3 is more expensive at this point despite it being nowhere as rare or unique.    This is a bit odd but understandable. Both engines have 80% of the same problems, the S85 has some uglier issues with its unique Vanos setup and ionic ignition that are costly maintenance. But V10 power and noise! The issue the M5 has is the SMG which is a huge POS, I have a manual and a SMG.   The M3 has more fanboyism and is more reliable because it doesn’t have the SMG. More demand means higher values. That’s ok like wrenching on my 500hp, 200mph cheap M5 despite all her flaws. I’d much rather have a CTS-V manual wagon tho, but in ain’t paying +50k"
tesla,,4,"I'm really considering leasing, something I never thought I would do. I just started a new job that's a 50 minute trip each way and my wife and I just had a daughter. Not sure if we're going to have more kids, not sure how much I'll be needing to go to work in-person post-pandemic, so what I need now might not be what I need in 4-5 years. Between that and the fact that leases are so ridiculously cheap right now, I'd definitely spend less per year on a lease. And realistically, after \~3 years, whatever I buy might have depreciated more from the purchase price than what I spent on a lease over that same time."
porsche,Porsche,3,"I don’t blame them for it, the whole situation just rubs me the wrong way. Toyota didn’t bring back the Supra because they love the car, and even if ‘the people on the inside who love it’ did, they should’ve stopped if they knew Toyota was going to turn it into a cash grab. They didn’t bring back that car we all know and love, they just took a bmw, repackaged it, and sold it to enthusiasts in an attempt to fool people into giving them money for a car that really isn’t all that special. The mr2 is no different. Yeah, sure the chief engineer might love the legacy of the car and its spirit, but if the higher ups are just going to have him repackage a Porsche Boxster, why would he even want to go through with it? There’s no passion there, no care for the actual car there. It’s just a couple of cronies finding a way to make a quick buck."
bentley,,6,"I’ve worked in car audio for the past decade and I can tell you that all but the top 1% of stock premium systems are nothing but smoke and mirrors and nowhere near audiophile quality. 99% of them still use paper speakers, junk amplification, zero sound deadening, and legit awful source units. Ever wonder why they make 19 speaker systems when the best home audio systems use 2? Yeah it’s just to flood the car interior with over-EQ’d mediocre sound to give the impression of good sound to people on a test drive.   You can buy a couple $79 pairs of aftermarket speakers, a $129 head unit, a $199 4 channel amp, and $75 worth of sound deadening and make your 15 year old Honda Accord sound better than 99% of factory premium systems with just an afternoon worth of work. Honestly those same $79 speaker pairs connected straight to the $129 head unit will sound better than most of those factory premium systems, especially when playing music from a CD or USB drive rather than over Bluetooth.   And of course a $1000 aftermarket setup, properly installed and tuned, will sound better than *anything* car manufacturers offer."
rollsroyce,,8,This car is new to me. Just Googled it and wow that is sweet.
bentley,,12,"Your salesman sounds like a really good one! I love hearing stories about other sales pros who give our industry a GOOD name, as opposed to the ones that make us all look bad. I think that the advent of the Internet Age has shined a light on who's good and who's bad thanks to review sites like Cars.com and DealerRater...I hope that a decade from now, all of the bad guys have been driven out completely by them. One can dream...  EXCELLENT point about hearing of recalls from the dealer before you hear it from the internet...this is an issue at most if not all dealers, and it really needs to change. It's funny, I've heard folks tell me about a bunch of ""normal"" stores that have awesome customer benefits, but not about a lot of luxury stores. Kind of weird, right? Thanks a ton for your input, pvera!"
porsche,,9,"I never said you should hoard every penny. When it comes to cars, it’s about trying to hoard a few tens of thousands dollars more. As a person who’s growing into his 30s with wealthy friends, I can say that cars alone definitely don’t bring you happiness. Neither does a $2M house. The community, the friends and what you do with your car brings you real happiness. You may enjoy the extra pizazz, horsepower and tightness of a brand new m3 over a used one, but the extra 60k you’re spending up front and the extra 40k you’ll lose relative to the older m3 in depreciation in the next 4 years - can buy you a lot of experiences, lessons, life value that can be - in particular - leveraged and enjoyed while you are still young.  An extra 10-20k saved and used on travel (not necessarily extravagant), language learning, sports coaching, cooking lessons, a nice bicycle, skiing lessons(and passes) in your 20s and 30s is enormously more useful, and (imo) fun compared to owning a brand new well specced m3 over an e90 m3.  That being said, if the choice is between a 25k new civic and a 30k c6 corvette, you’re not really being nearly as irresponsible by picking the corvette. I’d pick the vette any day"
tesla,Model S,44,Lighter than I expected tbh.   Some larger BMW M cars are over 4000lbs
tesla,Model S,1,Not surprised most people who buys Ev’s probably buy them for their MPG.
porsche,,3,"Yeah, 1200 hp is really usable on the street so that’s definitely where that is for."
tesla,,7,"I don’t mean cars specifically, I mean Taiwanese people just love Japanese stuff in general. And a number of Taiwanese cultural elements are sort of borrowed from Japan. The electrical system and rail system is either the same or very similar. Having been there before, the whole place kind of has a “China run by the Japanese” sort of vibe.  (Although that being said I know quite a few Taiwanese who love their Mazdas… no love for nu-Nissan though!)"
porsche,Porsche,3,Sounds like OC means the strategy Car and Driver uses to justify including very expensive trims that are essentially a different car from the base model. It's just most egregious with Porsche due to the price spread of their models. 
tesla,Model S,3,Are you the most basic ass version of an /r/cars stereotype?
ferrari,,15,"Not bad, not good. McLaren doesn't have first model year bugs, they have first few model years bugs after major platform updates (they switch the model name and add a bit more power every few years, but the model is fundamentally the same for a long time). I wouldn't buy one that's been out for less than 4-5 years. The 12C was the most infamous, but all of their models have this problem. Lambos, on the other hand, aren't any more or less reliable than the Audis whose parts they use, what you take that to mean depends on your opinion of Audi quality. They're just a lot more expensive to fix than Audis when they do break, which you don't have a problem with if you can afford a Lambo.  If you want maximum quality and durability but don't mind not standing out too much, Porsche would be #1 there. The only thing is, they must be GENAU PÜNKTLICH GEPFLEGT or they turn into unsalvageable basketcases. Do it down to the exact mile, don't even drive to the dealer if you'll be over the mileage interval when you get there, and treat ""recommended"" items as if they're as essential as oil changes. Nowhere else can you get a supercar that will be perfectly reliable and feel like new for 300k+ miles, but you sure have to work for it."
ferrari,,21,EVs have their place (I own one) but the exotic segment isn’t it.
tesla,,7,"> This is not a good thing for consumers. It’s a bad thing. It skirts laws and the spirit of those laws that are fundamentally pro-consumer…  The laws are there to protect the business of dealerships who act as middleman and extract a significant cost. Nothing more. This is rent-seeking to the fullest and I'm happy that someone has decided to fight against scumbags that make a living ripping off people.  In any public poll for the slimiest people in society, car salesman are duking it out with ambulance chasing lawyers for the lowest of the low in America."
tesla,Model S,2,They didn't solve it. It's exactly as OP describes even on a 2024 Model 3. You just drive on better roads.
lucid,,3,">(they're both minivans)  if the Gravity is questionably a minivan because no sliding door + big wheels, how on earth is something that doesn't even have third row seating a minivan?"
ferrari,,96,"The biggest ""hack"" was working for Jalopnik. Back when I started working for Jalopnik in 2013 I was convinced all I ever wanted to do was be a writer. I got an e-mail from a reader saying ""you should make videos"" so I was like... eh, OK, I'll give this a shot.   The Jalopnik columns drove traffic to my videos, which in turn convinced YouTube to start indexing me higher. One day, sitting on my couch in 2015, I realized I was getting more views on the videos than on my Jalopnik columns, and I should probably start focusing more on videos. And now here we are."
porsche,,14,"I see cars as consumables more than assets. If I drive it long enough (and I drive a LOT) it will be worth nothing, that's a consumable to me.  That old Corolla might depreciate more, but it'll need some repairs, will protect me less in case of crash, and generally speaking will be just the worst to drive around.  I'm choosing to invest more money in this part of my budget because it matters to me. Others go to restaurant more often than me, that depreciate a LOT more."
bentley,Bentley,39,"There is so much bad information offered here I had to butt in.     First, there is nothing magical about these cars.  They are big, heavy, powerful and have lots of expensive parts in them, and they aren't well understood but they are just cars.      RR/B incorporated and licensed a lot of parts and systems from other manufacturers instead of designing their own.  Here is a list:     1) Fuel injection:  Bosch K-jet, identical to a Mercedes W126 V8.  Most parts are interchangeable.     2) Transmission:  GM TH400 with a unique pan-mounted dipstick.  Other than the pan, nothing special about it except that gear selecting is done by a Rolls-Royce built electric motor.   3) Alternator, A/C compressor, power steering - All GM.   4) Brakes:  Citroen licensed mechanically pressurized hydraulic.  Dual front calipers but each wheel uses a L and R British Leyland caliper/pad from I think a Triumph.       They are very well built cars, but in the Rolls-Royce tradition they use 4 parts or fasteners where 2 would do, so everything takes a long time to take apart an reassemble.  They are also not optimized for service/repair.  Mercedes would machine out a dimple in the intake manifold you can access a hose clamp, Bentley simply says ""Remove intake manifold it access hose clamp.""     Everyone will warn you about the braking system.  It is complicated but offers incredible performance and stopping power.  It is very unforgiving of neglect, but stories of $15,000 brake jobs are the result of years of willful neglect.     With the car on a lift, carefully inspect all the braided steel brake hoses, there are 18-30 depending on the model.  If they are leaking or weeping, they need to be replaced.  Familiarize yourself with the de-pressurization and bleeding process first.    Don't buy the new hoses from RR or even Flying Spares for $100-180 each.  Take the old hose to your local hydraulic shop and they will make new ones for you from the fittings for $25 each.     This is an amazing resource for understanding the RR Braking system:   https://www.rrsilvershadow.com/ETechn/Hydr/Remintro.htm      Unfortunately, these cars have a bad reputation because most of the ones I've seen in the US have deferred maintenance, due to the North American attitude towards car repair:  ""I'll get a few more miles out of it an fix it when it breaks.""   That isn't how these cars were designed to be used.     They were designed to be used and serviced like aircraft - follow the service schedule, pay what it costs, and it will last forever.  There are planes from the 1930's still in service, and there are lots of Rolls and Bentleys from the same era still on the road.     They are designed for cost-no-object maintenance for people who might carefully review the invoice for servicing their Learjet but not even glance at the car repair bill because it has two less zeroes.       For the DIY owner, they take a lot of time and some money but it's not as bad as it's made out to be.  They tend to appeal to people who like mechanical puzzles.  Most of the people in the RROC that I've met are either wealthy adventurous types who dabble in DIY, or engineers/retired engineers who delight in learning about and mastering the mechanical wizardry.     Your cheap mechanic sounds risky, as there is simply no way to rush through service and repair.  Some parts do have to be ordered from Flying Spares so if you need to have it fixed *today* that could be problematic.       One thing that caught me by surprise on my car was that it started leaking fuel one day, badly.  It turns out the fuel system seals/O-rings are sensitive to ethanol on fuel and will wear out and leak.  The ensuing back to front fuel system rebuild ended up costing about $6,000 to switch over to viton seals.  I'm not sure if your Bosch K-jet car will need that, but my Zytek injection Continental R did.  It might be a '92 onwards problem.     I'd suggest joining the RROC and making use of their online forums.  This will help you understand the car, and if your mechanic the type to research and ask for advice online it will help him too.     Let me know if you have specific questions.  I've put 20,000 miles on a 1994 Continental R and I've done a fully DIY mechanical refresh of a '79 Silver Wraith (LWB Shadow)."
rollsroyce,,9,"I'm not a Mopar person but that car is seriously cool. That sort of story is something you'll never get to experience today. Everyone (in the auto enthusiast world at least) knows what each manufacturer is offering, everyone knows what each car is capable out of the showroom and what can be done with it with simple mods. Not only that but no one really had modified street cars capable of running an 8s 1/4 mile back in the day. I could go out buy a Hellcat, and some dude down the block with an LS Swap Turbo Foxbody could crush me.   The only legendary street racing car I know of is the beater bomb Foxbody which is exactly what I described, a  turbo LS Foxbody. It's put together extremely well it hooks very well. He takes down almost everything within its category."
tesla,Model S,3,"Tesla gets a bad rep for certain aspects of their build quality. However, where they lack physical quality, they make up for in software. The average Tesla owner isn't a petrol head and doesn't care about panel gaps, creaky plastic etc... They want a car that will get them from point A to B in a cheap and comfortable way."
bentley,,8,"Did a quick skim of the contenders, laptimes, and specs, and it's actually super impressive how many cars were able to keep up a good pace this year! If I may ask, a lot of these cars have previously made multiple appearances at previous LLs, and if they haven't, than their predecessors certainly have. What were some things you noticed in particular about certain models that separated them from their previous MYs or generations that you liked or disliked, whether it be suspension tuning, tire choice, aerodynamics, etc.  P.S. y'all are awesome at your work, I skim the website almost daily, reading the articles you guys put out."
tesla,Tesla,4,"A friend of mine was ridiculing electric vehicles and Tesla ten years ago when I told him this is the future, and that Tesla will be bigger than any automotive company in the world.   He is still ridiculing Tesla, and sends me articles like these, where ""aha! One Porsche model was sold more than one from Tesla!"".   I find it amazing how he keeps moving the goal, but in his mind he is still in the same argument with me. In only 10 years, we got to the point where it's fair comparison between a startup company and freaking Porsche, with Porsche even being seen as an underdog. And 10 years ago, ""Porsche selling more EVs than 911s in 2021"" was nothing but a bad joke."
porsche,911,7,"few thoughts on this article  * The 6 speed in the GT3 is one of the few truly great manual transmissions still out there. It is night-and-day different from the 7-speed manuals in the rest of the 911 lineup * Most manual transmissions are not great. The GT3 is one exception, the GT350 is another. Miata another good one.  * Examples of vague/poor manuals:  non-Shelby Mustangs, Camaros, Corvettes, BMWs, nearly every sports car out there.  * Why is this? Manuals are now an afterthought for vast majority of cars, it is only those few exceptions I mentioned above where the manual is the PRIMARY option for the car. In all other cases, performance and synergy with the rest of the powertrain is done with the automatic transmission in mind. * There are still some random economy cars out there that have great shifters - I call these happy accidents. Older Civics are a perfect example, I'm sure there are others (new Corolla?)."
lucid,Lucid,18,"But where would it go?   If Lucid raises prices from 100k -> 150k to clear the model s, it'll get owned even more than right now  if tesla lowers prices of the model s it'll cannibalize sales from the model 3, unless they also lower the model 3, which they can't do because their profits on the 3 aren't as good as other models. It's really the model y that's their moneymaker  I don't see a good solution for Lucid, tbh"
bentley,,3,"Not to mention, it's fucking scary and more dangerous than normal racetracks for all but the most experienced drivers. There are no guard rails on the switch backs, the roads are narrow with little shoulder, and immediately over the edge are *steep* drop offs. The smallest error that would be ""no big deal"" on a normal race track could easily result in death on Pikes Peak.   I'm not scared of heights. I pride myself on being a very competent and safe driver. But last summer I drove up Pike's Peak and once we got passed the treeline, my heart rate went up a bit and palms were sweaty. First time I'd ever felt that when driving."
tesla,,4,"In the future: JATO Dynamics is a *European analysis outlet,* so the context is Europe. It's not a headline without context, you just don't have the context. People who go to read JATO Dynamics releases all know they pertain to the European market unless otherwise specified.  For the same reason, if ""USA Today"" reports on a decrease in crime, you should assume the context is the USA."
bentley,Bentley,4,"James Bond helped a bit, but Aston is exactly as you put it, they're the perfect in-between. It's sporty enough, it's luxurious enough, and it's fancy enough, Bentley and Ferrari are way too much of what they're good at.   Ferrari is sporty and flashy, probably too sporty, and their dealers and SOME of their owners are too pretentious. Meanwhile, Bentley is luxurious and flashy it's a nice place to be in but it's not sporty enough for some...also people may think you sell some fine products.   Aston is the best of both and it's more low-key because weirdly enough, a lot of people have no idea what they are. So you also have a rarer vehicle because you may see multiple Ferraris or Bentleys in an area, but you might see 1 Aston. At least in my area that's how it is the areas are flooded with Ferraris, Lamborghinis, McLarens, Range Rovers, Rolls-Royces, and Bentleys, it's to the point that they're just normal traffic and not special to see anymore, but every now and then an Aston pops up and you're like oh hello there pretty thing lol."
porsche,,5,"Skoda and VW seem to have way too much overlap, but at least they seem to have realized that Seat being in the same segment was taking things a bit too far and are now repositioning it as the affordable performance sub-brand (à la Pontiac) through the rebranding to Cupra"
rollsroyce,,3,"The Performance Model 3 I've rented a few months ago was an absolute blast to push in the twisities, besides the mind boggling acceleration. You do somewhat feel the weight of the car, but it's very precise, predictable and confidence inspiring. I thoroughly enjoyed every second of it, and I've driven several high performance german sport cars before. I don't care about stereotypes or perceptions - it is a proper car enthusiast sedan, arguably the best at that price point.  The S P85+ I drove two years earlier was another story though, it really felt heavy and numb in tight corners, canyon carving really isn't its forte.  I also liked one pedal driving with the highest regen setting, it's quite relaxing once you get used to it. As other said, no seat issues here, I'm slightly under 6'.  I'll most likely go for a 4WD Model Y once my lease is over in 2022. I'd love a Performance one, but the premium is quite hard to justify for our daily when it's used on slow city streets ridden with potholes most of the time.  I will miss ventilated seats, Android auto and physical HVAC controls though."
bentley,,5,"luxury car brands in Korea should lean into it, try and make the green license plate a vogue item to be sort after."
tesla,Model S,3,"Fully loaded Model S refreshed Plaid is $146,490 USD plus local taxes and minus any incentives if you have them.   That is 21"" wheels, white interior.   FSD is 10k and not really necessary so I would say that actual cost is $136,490 plus taxes.     The Taycan Turbo S Cross Turismo starts at $188,950 and can be speced out far higher then that.   Typical Porche you can customize just about everything.    But even that base car needs $300 option to add power folding side mirrors and many other small things.   You can easily price it up to well above 200k."
ferrari,,42,"I mean it's all perspective.  I had an RSX-S as my first 'grown-up car' that had 200hp at 2800lbs.  I felt like that was plenty quick, P/W of .071, essentially the same as a 1st gen 86/BRZ  Then I owned an S2000, so 240hp at 2800lbs.  P/W of .085, but no torque to speak of.  Now I'm in my Genesis with 311hp at 4000lbs, P/W of .077  If .071 was adequately quick, why wouldn't .077 be?  I think the Genesis has plenty of zip when I want to get on it, even if tossing 2 tons around in the corners seems like too much inertia for me.  I think it's more a factor of car guys chasing numbers and the pony cars having crazy high HP now comparatively.  You can still get in plenty of trouble with the power to weight ratio that sport compacts provide.  The frame of reference for people in the community has just shifted, but most normal people think 300hp still has plenty of zip in anything that's not an SUV."
rollsroyce,,3,"I've noticed it too. I had a 1989 Mercedes W124 (sold a couple years ago), my god was it smooth. Way smoother than pretty much any other car I've ever driven."
porsche,,39,Three shifts to hit 60 and rev hang will do that
ferrari,,4,"Yes, clearly only 100 people want manuals. That's why GM is making a business case for them and saying they expect a 25-35% take rate on it.   I'm aware most people don't buy manuals. But you asked why we should save them and you got your answer.    Why do we(we being car enthusiasts who want to row our own gears) want to save manuals? Because we enjoy them. Maybe you don't, and thats fine. But there is the simple answer to your question."
lucid,,6," I mean, the number one biggest visual representation of electricity we have is light. So I find it fitting. You'll see those vehicles and have no doubt they are fully electric. Aside from the design language you mentioned  in the 90s, even modern IC vehicles have a grill separating the headlights. It's that constant reminder that air needs to pass through there to cool that ICE. You don't need that gap there for an EV. So they symbolize it with a continuous light bar.  At least that's how I imagine it anyway"
ferrari,,3,"That’s a good review. I’m loving mine and it’s actually really comfy on a road trip.   Biggest negative IMO is the fuel cutoff at redline, feels like you slammed on the brakes. Other than that I love it"
bentley,,3,"Another con you forgot to mention is poor cargo capacity and back seat room. It's been remarked about by almost everyone who reviews the G70 that the cargo capacity and back seat room are just not up to par compared to the rest of the class. For most everyday scenarios, they probably work just fine. But when you have 6'0""+ adults in the back, or you need to haul your whole family plus their suitcases to the airport - the G70 will be significantly worse at that task than a 3 series or A4."
